number,value,datetime_start,datetime_complete,duration,params_activation,params_lr,params_n_layers,params_n_units_l0,params_n_units_l1,params_n_units_l2,params_n_units_l3,params_n_units_l4,params_n_units_l5,params_n_units_l6,params_n_units_l7,params_n_units_l8,params_n_units_l9,state,RMSE
357,0.16544406116008759,2026-04-16 09:18:35.749923,2026-04-16 09:18:40.866168,0 days 00:00:05.116245,GELU,0.002710285174848397,2,207,61.0,,,,,,,,,COMPLETE,0.4067481544642675
358,0.4819015562534332,2026-04-16 09:18:40.866539,2026-04-16 09:19:02.831527,0 days 00:00:21.964988,GELU,0.0008046029371787174,10,221,140.0,170.0,98.0,82.0,181.0,59.0,61.0,123.0,181.0,COMPLETE,0.69419129658433
359,1.7309131622314453,2026-04-16 09:19:02.831905,2026-04-16 09:19:03.754151,0 days 00:00:00.922246,GELU,0.004297437483543421,4,227,47.0,68.0,86.0,,,,,,,PRUNED,1.3156417301953618
360,1.327868938446045,2026-04-16 09:19:03.754482,2026-04-16 09:19:05.622366,0 days 00:00:01.867884,GELU,0.0011298901729835157,7,238,66.0,94.0,56.0,157.0,222.0,133.0,,,,PRUNED,1.1523319567060721
361,0.9912952780723572,2026-04-16 09:19:05.622719,2026-04-16 09:19:06.571600,0 days 00:00:00.948881,GELU,0.001972200840550403,4,88,90.0,114.0,64.0,,,,,,,PRUNED,0.9956381260640621
362,1.5631366968154907,2026-04-16 09:19:06.571937,2026-04-16 09:19:07.549473,0 days 00:00:00.977536,GELU,0.0004608892911639218,4,217,80.0,54.0,110.0,,,,,,,PRUNED,1.2502546527869796
363,20.579479217529297,2026-04-16 09:19:07.549816,2026-04-16 09:19:08.315999,0 days 00:00:00.766183,ELU,0.00646222605115187,2,232,153.0,,,,,,,,,PRUNED,4.536461089608209
364,0.9138310551643372,2026-04-16 09:19:08.316338,2026-04-16 09:19:09.512388,0 days 00:00:01.196050,GELU,0.0008386895735404144,5,210,73.0,49.0,137.0,124.0,,,,,,PRUNED,0.9559451109579133
365,1.4428107738494873,2026-04-16 09:19:09.512725,2026-04-16 09:19:10.420643,0 days 00:00:00.907918,GELU,0.0015127877568746394,4,196,53.0,62.0,92.0,,,,,,,PRUNED,1.2011705848252725
366,1.6653915643692017,2026-04-16 09:19:10.420980,2026-04-16 09:19:11.085793,0 days 00:00:00.664813,GELU,0.003319228795649101,3,13,164.0,80.0,,,,,,,,PRUNED,1.2905005092479436
367,0.9739333391189575,2026-04-16 09:19:11.086126,2026-04-16 09:19:12.077666,0 days 00:00:00.991540,GELU,0.002238169853623679,4,222,85.0,88.0,101.0,,,,,,,PRUNED,0.9868806103673116
368,79.45686340332031,2026-04-16 09:19:12.078007,2026-04-16 09:19:12.707169,0 days 00:00:00.629162,ReLU,0.0010449339240600059,4,226,60.0,133.0,80.0,,,,,,,PRUNED,8.913857941616543
369,0.17994321882724762,2026-04-16 09:19:12.707509,2026-04-16 09:19:23.126908,0 days 00:00:10.419399,GELU,0.0005820931274039475,5,242,104.0,71.0,68.0,33.0,,,,,,COMPLETE,0.42419714617998977
370,1.4900426864624023,2026-04-16 09:19:23.127286,2026-04-16 09:19:23.771580,0 days 00:00:00.644294,GELU,0.0014898340509689998,2,204,39.0,,,,,,,,,PRUNED,1.2206730465044284
371,0.2149403840303421,2026-04-16 09:19:23.771931,2026-04-16 09:19:31.284447,0 days 00:00:07.512516,GELU,0.0027187633102270063,3,98,77.0,224.0,,,,,,,,COMPLETE,0.46361663476448095
372,79.53602600097656,2026-04-16 09:19:31.284828,2026-04-16 09:19:32.094621,0 days 00:00:00.809793,Tanh,5.1254071209894834e-05,4,248,68.0,99.0,94.0,,,,,,,PRUNED,8.91829725906109
373,1878.81396484375,2026-04-16 09:19:32.094971,2026-04-16 09:19:33.200890,0 days 00:00:01.105919,GELU,1.1111061792171711e-07,4,232,173.0,13.0,35.0,,,,,,,PRUNED,43.34528768901817
374,3.4566128253936768,2026-04-16 09:19:33.201236,2026-04-16 09:19:34.387735,0 days 00:00:01.186499,GELU,0.01192350044209797,4,218,178.0,76.0,107.0,,,,,,,PRUNED,1.8591968226612472
375,5.016104698181152,2026-04-16 09:19:34.388077,2026-04-16 09:19:34.819718,0 days 00:00:00.431641,GELU,0.0008306873575543222,2,75,43.0,,,,,,,,,PRUNED,2.2396662024018563
376,0.918846845626831,2026-04-16 09:19:34.820052,2026-04-16 09:19:36.217314,0 days 00:00:01.397262,GELU,0.0012444057541843056,5,224,57.0,121.0,116.0,228.0,,,,,,PRUNED,0.9585649929070178
377,1.0042128562927246,2026-04-16 09:19:36.217664,2026-04-16 09:19:37.163158,0 days 00:00:00.945494,GELU,0.0018395653786935893,4,213,64.0,64.0,127.0,,,,,,,PRUNED,1.0021042142874785
378,0.30521243810653687,2026-04-16 09:19:37.163498,2026-04-16 09:19:46.780672,0 days 00:00:09.617174,GELU,0.003740517171302209,4,235,94.0,107.0,86.0,,,,,,,COMPLETE,0.5524603498048859
379,10.720521926879883,2026-04-16 09:19:46.781046,2026-04-16 09:19:47.228092,0 days 00:00:00.447046,GELU,0.0007706377873733963,1,228,,,,,,,,,,PRUNED,3.274220812174995
380,1.2135820388793945,2026-04-16 09:19:47.228445,2026-04-16 09:19:48.333639,0 days 00:00:01.105194,GELU,0.004993291203511935,3,221,72.0,84.0,,,,,,,,PRUNED,1.1016269962557175
381,4.118229866027832,2026-04-16 09:19:48.333989,2026-04-16 09:19:49.248582,0 days 00:00:00.914593,Softplus,0.0023143243395756987,4,215,81.0,90.0,47.0,,,,,,,PRUNED,2.0293422249654767
382,1.4641040563583374,2026-04-16 09:19:49.248918,2026-04-16 09:19:50.056953,0 days 00:00:00.808035,GELU,0.00113417758230933,2,224,205.0,,,,,,,,,PRUNED,1.2100016761799701
383,1.5014921426773071,2026-04-16 09:19:50.057289,2026-04-16 09:19:50.917671,0 days 00:00:00.860382,GELU,0.0016318531192930136,4,91,86.0,43.0,145.0,,,,,,,PRUNED,1.2253538846705907
384,1.712407112121582,2026-04-16 09:19:50.918001,2026-04-16 09:19:51.864653,0 days 00:00:00.946652,GELU,0.0004144615465784336,4,208,68.0,95.0,73.0,,,,,,,PRUNED,1.3085897417149432
385,1.7771415710449219,2026-04-16 09:19:51.864996,2026-04-16 09:19:53.707677,0 days 00:00:01.842681,GELU,0.0006137659568946683,10,155,51.0,70.0,81.0,110.0,101.0,109.0,94.0,1.0,7.0,PRUNED,1.333094734459979
386,0.9680711030960083,2026-04-16 09:19:53.708025,2026-04-16 09:19:55.497421,0 days 00:00:01.789396,GELU,0.001082946309821465,6,171,77.0,115.0,225.0,171.0,36.0,,,,,PRUNED,0.9839060438354916
387,1.133423924446106,2026-04-16 09:19:55.497763,2026-04-16 09:19:56.066120,0 days 00:00:00.568357,GELU,0.0025404670631630605,2,179,89.0,,,,,,,,,PRUNED,1.064623841761073
388,3.0428080558776855,2026-04-16 09:19:56.066445,2026-04-16 09:19:57.196649,0 days 00:00:01.130204,GELU,0.0002717299052443833,5,229,32.0,102.0,102.0,94.0,,,,,,PRUNED,1.7443646567956155
389,1892.85546875,2026-04-16 09:19:57.196986,2026-04-16 09:19:57.973529,0 days 00:00:00.776543,GELU,2.3778331515811817e-08,3,219,81.0,77.0,,,,,,,,PRUNED,43.50695885430284
390,3.0724480152130127,2026-04-16 09:19:57.973867,2026-04-16 09:19:58.917032,0 days 00:00:00.943165,ELU,0.0016128017957212585,4,239,99.0,57.0,121.0,,,,,,,PRUNED,1.7528399856270431
391,1843.126220703125,2026-04-16 09:19:58.917369,2026-04-16 09:19:59.760433,0 days 00:00:00.843064,GELU,2.1993557150920903e-06,4,82,73.0,85.0,90.0,,,,,,,PRUNED,42.931645911880956
392,2.7070631980895996,2026-04-16 09:19:59.760763,2026-04-16 09:20:00.320533,0 days 00:00:00.559770,GELU,0.0007852309496341214,2,200,58.0,,,,,,,,,PRUNED,1.6453155314679309
393,0.9496877193450928,2026-04-16 09:20:00.320876,2026-04-16 09:20:02.161291,0 days 00:00:01.840415,GELU,0.0031153540382118546,4,212,111.0,68.0,104.0,,,,,,,PRUNED,0.9745192247180621
394,116.0890121459961,2026-04-16 09:20:02.161613,2026-04-16 09:20:02.775846,0 days 00:00:00.614233,ReLU,0.07580507607282522,4,231,66.0,75.0,96.0,,,,,,,PRUNED,10.774461106987955
395,0.06835582852363586,2026-04-16 09:20:02.776199,2026-04-16 09:20:17.480731,0 days 00:00:14.704532,GELU,0.00131839971769696,7,223,77.0,156.0,59.0,53.0,120.0,186.0,,,,COMPLETE,0.2614494760439115
396,1.275753140449524,2026-04-16 09:20:17.481114,2026-04-16 09:20:19.174625,0 days 00:00:01.693511,GELU,0.0019858597572739627,7,217,71.0,153.0,63.0,57.0,120.0,237.0,,,,PRUNED,1.1294924260257453
397,0.5599632859230042,2026-04-16 09:20:19.174972,2026-04-16 09:20:36.225569,0 days 00:00:17.050597,GELU,0.0010682569470453996,9,224,50.0,62.0,49.0,41.0,139.0,184.0,30.0,222.0,,COMPLETE,0.748306946328179
398,10.641107559204102,2026-04-16 09:20:36.225955,2026-04-16 09:20:37.668931,0 days 00:00:01.442976,Tanh,0.0006346209499474699,10,144,64.0,80.0,24.0,18.0,67.0,86.0,217.0,76.0,49.0,PRUNED,3.2620710536719004
399,0.6807063817977905,2026-04-16 09:20:37.669277,2026-04-16 09:20:49.674181,0 days 00:00:12.004904,GELU,0.0074888077705539706,6,211,76.0,146.0,57.0,26.0,193.0,,,,,COMPLETE,0.8250493208274221
400,5.354376316070557,2026-04-16 09:20:49.674550,2026-04-16 09:20:51.711572,0 days 00:00:02.037022,GELU,0.004160120235253983,7,219,55.0,161.0,61.0,79.0,240.0,200.0,,,,PRUNED,2.3139525310754663
401,0.2588181793689728,2026-04-16 09:20:51.711932,2026-04-16 09:21:06.386127,0 days 00:00:14.674195,GELU,0.0014595625794821504,8,236,63.0,51.0,40.0,41.0,49.0,160.0,178.0,,,COMPLETE,0.5087417609838736
402,1.1640876531600952,2026-04-16 09:21:06.386496,2026-04-16 09:21:08.713737,0 days 00:00:02.327241,GELU,0.0008854459047735764,9,231,70.0,182.0,69.0,184.0,158.0,130.0,124.0,143.0,,PRUNED,1.0789289379565714
403,0.11105918139219284,2026-04-16 09:21:08.714085,2026-04-16 09:21:26.673239,0 days 00:00:17.959154,GELU,0.0019696064964296084,8,223,250.0,72.0,51.0,102.0,25.0,218.0,55.0,,,COMPLETE,0.3332554296514805
404,0.409394234418869,2026-04-16 09:21:26.673616,2026-04-16 09:21:44.972129,0 days 00:00:18.298513,GELU,0.002006624927074606,8,226,232.0,72.0,56.0,102.0,25.0,255.0,54.0,,,COMPLETE,0.6398392254456341
405,0.13734731078147888,2026-04-16 09:21:44.972520,2026-04-16 09:22:01.260074,0 days 00:00:16.287554,GELU,0.0013476892728709825,8,224,199.0,64.0,43.0,72.0,10.0,222.0,27.0,,,COMPLETE,0.37060398106534
406,0.17689266800880432,2026-04-16 09:22:01.260450,2026-04-16 09:22:18.078192,0 days 00:00:16.817742,GELU,0.00108530148395477,7,235,238.0,79.0,52.0,117.0,33.0,235.0,,,,COMPLETE,0.42058610058917106
407,0.9897377490997314,2026-04-16 09:22:18.078585,2026-04-16 09:22:20.062099,0 days 00:00:01.983514,GELU,0.00043948777182192643,8,229,189.0,69.0,111.0,88.0,57.0,191.0,39.0,,,PRUNED,0.9948556423420091
408,7.747644424438477,2026-04-16 09:22:20.062456,2026-04-16 09:22:21.970694,0 days 00:00:01.908238,Softplus,0.0017289701693953806,9,96,212.0,59.0,48.0,141.0,44.0,215.0,86.0,108.0,,PRUNED,2.783459075402129
409,13.96022891998291,2026-04-16 09:22:21.971044,2026-04-16 09:22:23.553761,0 days 00:00:01.582717,GELU,0.00011936136334488105,8,103,247.0,74.0,61.0,10.0,76.0,88.0,14.0,,,PRUNED,3.7363389728426557
410,0.9882485866546631,2026-04-16 09:22:23.554096,2026-04-16 09:22:24.680905,0 days 00:00:01.126809,GELU,0.0007496503731573804,5,243,17.0,201.0,54.0,54.0,,,,,,PRUNED,0.9941069291855194
411,4.620436668395996,2026-04-16 09:22:24.681248,2026-04-16 09:22:27.208595,0 days 00:00:02.527347,GELU,0.00238958500073476,9,221,44.0,169.0,131.0,131.0,93.0,114.0,256.0,189.0,,PRUNED,2.149520101882277
412,1.0134224891662598,2026-04-16 09:22:27.208954,2026-04-16 09:22:29.325352,0 days 00:00:02.116398,GELU,0.0010229398374768065,9,217,215.0,153.0,1.0,122.0,26.0,69.0,62.0,164.0,,PRUNED,1.006688874065001
413,0.08203587681055069,2026-04-16 09:22:29.325717,2026-04-16 09:22:50.321294,0 days 00:00:20.995577,GELU,0.00141447565854577,10,230,145.0,84.0,66.0,158.0,84.0,160.0,16.0,44.0,120.0,COMPLETE,0.2864190580435434
414,12.431068420410156,2026-04-16 09:22:50.321671,2026-04-16 09:22:53.587907,0 days 00:00:03.266236,GELU,0.0015535474730095714,10,233,141.0,86.0,69.0,160.0,87.0,167.0,16.0,60.0,120.0,PRUNED,3.525772031826527
415,4.8575029373168945,2026-04-16 09:22:53.588258,2026-04-16 09:22:55.168267,0 days 00:00:01.580009,ELU,0.0025167793154686744,7,229,59.0,142.0,66.0,150.0,113.0,149.0,,,,PRUNED,2.2039743504217317
416,1.0160963535308838,2026-04-16 09:22:55.168622,2026-04-16 09:22:57.447203,0 days 00:00:02.278581,GELU,0.0018162370108557929,10,235,150.0,92.0,59.0,98.0,103.0,139.0,36.0,34.0,165.0,PRUNED,1.0080160482506635
417,2.6681439876556396,2026-04-16 09:22:57.447555,2026-04-16 09:23:00.300182,0 days 00:00:02.852627,GELU,0.0031233863765205675,10,242,252.0,83.0,73.0,191.0,66.0,203.0,16.0,222.0,113.0,PRUNED,1.6334454345510412
418,0.3395141065120697,2026-04-16 09:23:00.300539,2026-04-16 09:23:20.443691,0 days 00:00:20.143152,GELU,0.001287086624614291,10,227,137.0,77.0,64.0,166.0,41.0,181.0,3.0,93.0,183.0,COMPLETE,0.5826783902909646
419,8.07226848602295,2026-04-16 09:23:20.444080,2026-04-16 09:23:22.592189,0 days 00:00:02.148109,GELU,0.0022081031278161994,8,250,218.0,89.0,51.0,147.0,121.0,122.0,101.0,,,PRUNED,2.841173786663348
420,85.93113708496094,2026-04-16 09:23:22.592546,2026-04-16 09:23:23.828863,0 days 00:00:01.236317,ReLU,0.0005495114373107184,10,222,49.0,82.0,78.0,137.0,16.0,154.0,47.0,128.0,41.0,PRUNED,9.269904912401255
421,3.224252223968506,2026-04-16 09:23:23.829225,2026-04-16 09:23:26.168892,0 days 00:00:02.339667,GELU,0.0013959443998869457,10,238,54.0,93.0,44.0,104.0,80.0,192.0,73.0,70.0,129.0,PRUNED,1.7956202894733915
422,1.152153730392456,2026-04-16 09:23:26.169229,2026-04-16 09:23:28.041022,0 days 00:00:01.871793,GELU,0.000844679252913855,9,230,24.0,73.0,75.0,129.0,69.0,107.0,82.0,33.0,,PRUNED,1.073384241729147
423,0.45625102519989014,2026-04-16 09:23:28.041372,2026-04-16 09:23:36.606443,0 days 00:00:08.565071,GELU,0.0018696335324338185,3,222,146.0,86.0,,,,,,,,COMPLETE,0.6754635631918943
424,1.6988794803619385,2026-04-16 09:23:36.606824,2026-04-16 09:23:38.935613,0 days 00:00:02.328789,GELU,0.003150476373715689,10,227,155.0,138.0,29.0,109.0,54.0,166.0,41.0,3.0,104.0,PRUNED,1.303410710544431
425,1.0952889919281006,2026-04-16 09:23:38.935961,2026-04-16 09:23:41.654565,0 days 00:00:02.718604,GELU,0.0012523612841123188,10,112,134.0,97.0,89.0,63.0,7.0,237.0,57.0,206.0,222.0,PRUNED,1.0465605533977003
426,3.2605557441711426,2026-04-16 09:23:41.654938,2026-04-16 09:23:42.677553,0 days 00:00:01.022615,Tanh,0.0006703864159986705,5,234,157.0,79.0,37.0,156.0,,,,,,PRUNED,1.8057009010827743
427,5.297410011291504,2026-04-16 09:23:42.677905,2026-04-16 09:23:44.385821,0 days 00:00:01.707916,GELU,0.00488194933558528,9,68,36.0,67.0,117.0,46.0,133.0,76.0,23.0,146.0,,PRUNED,2.3016103083040584
428,1.0912266969680786,2026-04-16 09:23:44.386172,2026-04-16 09:23:45.391447,0 days 00:00:01.005275,GELU,0.0023506996146900683,5,43,128.0,74.0,16.0,198.0,,,,,,PRUNED,1.0446179669946705
429,1.5467126369476318,2026-04-16 09:23:45.391785,2026-04-16 09:23:47.516084,0 days 00:00:02.124299,GELU,0.0009852525079254756,10,222,61.0,102.0,124.0,77.0,40.0,137.0,2.0,176.0,59.0,PRUNED,1.2436690222674327
430,1.0004472732543945,2026-04-16 09:23:47.516454,2026-04-16 09:23:48.253119,0 days 00:00:00.736665,GELU,0.00160260042463016,3,91,150.0,83.0,,,,,,,,PRUNED,1.0002236116261176
431,7.668329238891602,2026-04-16 09:23:48.253462,2026-04-16 09:23:48.662237,0 days 00:00:00.408775,GELU,0.0013493071957344429,1,228,,,,,,,,,,PRUNED,2.7691748299613734
432,0.09133760631084442,2026-04-16 09:23:48.662581,2026-04-16 09:24:01.506674,0 days 00:00:12.844093,GELU,0.003129147970234512,6,218,69.0,89.0,58.0,178.0,2.0,,,,,COMPLETE,0.3022211215498421
433,2.801476001739502,2026-04-16 09:24:01.507057,2026-04-16 09:24:02.747429,0 days 00:00:01.240372,GELU,0.03287786009983427,5,217,47.0,79.0,55.0,183.0,,,,,,PRUNED,1.673761034837262
434,1.2340574264526367,2026-04-16 09:24:02.747780,2026-04-16 09:24:04.279239,0 days 00:00:01.531459,GELU,0.0008984582735368072,7,218,66.0,86.0,64.0,167.0,3.0,206.0,,,,PRUNED,1.1108813737085688
435,4.2981276512146,2026-04-16 09:24:04.279589,2026-04-16 09:24:05.771895,0 days 00:00:01.492306,GELU,0.0038633752698545663,7,224,41.0,90.0,51.0,203.0,21.0,96.0,,,,PRUNED,2.073192622795721
436,1.3626549243927002,2026-04-16 09:24:05.772246,2026-04-16 09:24:07.093488,0 days 00:00:01.321242,GELU,0.0005019989118820761,6,238,57.0,68.0,59.0,175.0,27.0,,,,,PRUNED,1.1673281134251416
437,0.8539789319038391,2026-04-16 09:24:07.093841,2026-04-16 09:24:19.209182,0 days 00:00:12.115341,GELU,0.0019533237670178996,6,230,63.0,74.0,71.0,179.0,30.0,,,,,COMPLETE,0.9241098051118379
438,0.69718998670578,2026-04-16 09:24:19.209583,2026-04-16 09:24:36.252966,0 days 00:00:17.043383,GELU,0.0007033625757488324,7,215,220.0,95.0,83.0,144.0,15.0,223.0,,,,COMPLETE,0.8349790336923317
439,90.09839630126953,2026-04-16 09:24:36.253339,2026-04-16 09:24:38.159136,0 days 00:00:01.905797,Softplus,0.00034515943529967775,8,222,84.0,82.0,65.0,212.0,50.0,189.0,128.0,,,PRUNED,9.492017504264808
440,0.48733311891555786,2026-04-16 09:24:38.159486,2026-04-16 09:24:51.132576,0 days 00:00:12.973090,GELU,0.0011944005658971078,6,225,144.0,64.0,58.0,153.0,61.0,,,,,COMPLETE,0.6980924859326004
441,4.082150936126709,2026-04-16 09:24:51.132957,2026-04-16 09:24:52.314027,0 days 00:00:01.181070,ELU,0.0016843715403518746,6,233,31.0,89.0,47.0,161.0,36.0,,,,,PRUNED,2.020433353547379
442,1.8380420207977295,2026-04-16 09:24:52.314376,2026-04-16 09:24:53.777303,0 days 00:00:01.462927,GELU,0.0052451341909470674,7,218,74.0,77.0,106.0,85.0,10.0,173.0,,,,PRUNED,1.3557440838143937
443,2.465205192565918,2026-04-16 09:24:53.777667,2026-04-16 09:24:54.997416,0 days 00:00:01.219749,GELU,0.0030875429579676128,5,246,68.0,71.0,99.0,170.0,,,,,,PRUNED,1.5700971920763116
444,1.2449840307235718,2026-04-16 09:24:54.997758,2026-04-16 09:24:56.667043,0 days 00:00:01.669285,GELU,0.0022311611813514987,8,226,57.0,66.0,79.0,114.0,2.0,119.0,68.0,,,PRUNED,1.1157885241942451
445,1873.2208251953125,2026-04-16 09:24:56.667396,2026-04-16 09:24:57.520607,0 days 00:00:00.853211,GELU,4.6129006421724054e-07,4,240,12.0,60.0,92.0,,,,,,,PRUNED,43.2807211723108
446,0.17277035117149353,2026-04-16 09:24:57.520943,2026-04-16 09:25:09.846497,0 days 00:00:12.325554,GELU,0.0009525955258166792,6,215,53.0,96.0,112.0,91.0,99.0,,,,,COMPLETE,0.4156565302885226
447,83.8314208984375,2026-04-16 09:25:09.846876,2026-04-16 09:25:10.460331,0 days 00:00:00.613455,ReLU,0.0013579530582914106,4,220,76.0,84.0,71.0,,,,,,,PRUNED,9.155950027082799
448,1.625694751739502,2026-04-16 09:25:10.460674,2026-04-16 09:25:11.428068,0 days 00:00:00.967394,GELU,0.0006375432566504955,4,208,90.0,77.0,87.0,,,,,,,PRUNED,1.2750273533299206
449,0.14840759336948395,2026-04-16 09:25:11.428414,2026-04-16 09:25:20.251997,0 days 00:00:08.823583,GELU,0.0009294406791959011,4,232,83.0,90.0,61.0,,,,,,,COMPLETE,0.3852370612616132
450,130.5808868408203,2026-04-16 09:25:20.252359,2026-04-16 09:25:21.202976,0 days 00:00:00.950617,GELU,2.002233646445638e-05,4,224,67.0,71.0,94.0,,,,,,,PRUNED,11.427199431217621
451,16.68175506591797,2026-04-16 09:25:21.203320,2026-04-16 09:25:22.285802,0 days 00:00:01.082482,Tanh,0.0017616510034358652,5,230,162.0,133.0,53.0,69.0,,,,,,PRUNED,4.08433043055015
452,3.4524176120758057,2026-04-16 09:25:22.286151,2026-04-16 09:25:23.544436,0 days 00:00:01.258285,GELU,0.020482847364323292,4,215,255.0,81.0,43.0,,,,,,,PRUNED,1.8580682474214465
453,0.06970518827438354,2026-04-16 09:25:23.544786,2026-04-16 09:25:32.261355,0 days 00:00:08.716569,GELU,0.003786914468374445,4,220,60.0,88.0,75.0,,,,,,,COMPLETE,0.2640174014613119
454,1.3418660163879395,2026-04-16 09:25:32.261723,2026-04-16 09:25:34.398691,0 days 00:00:02.136968,GELU,0.005635009835686262,9,211,58.0,110.0,64.0,188.0,47.0,160.0,50.0,233.0,,PRUNED,1.158389406196353
455,1.906093716621399,2026-04-16 09:25:34.399045,2026-04-16 09:25:36.573057,0 days 00:00:02.174012,GELU,0.0035182870066959044,10,219,50.0,193.0,75.0,180.0,22.0,245.0,18.0,53.0,136.0,PRUNED,1.3806135290592363
456,0.9247116446495056,2026-04-16 09:25:36.573405,2026-04-16 09:25:37.766558,0 days 00:00:01.193153,GELU,0.002752070074345043,4,207,61.0,97.0,69.0,,,,,,,PRUNED,0.9616192825903116
457,0.9965646862983704,2026-04-16 09:25:37.766892,2026-04-16 09:25:39.045638,0 days 00:00:01.278746,GELU,0.006870236128041751,5,219,53.0,93.0,161.0,122.0,,,,,,PRUNED,0.9982808654373629
458,1.1647019386291504,2026-04-16 09:25:39.045995,2026-04-16 09:25:40.093263,0 days 00:00:01.047268,GELU,0.010010779295352813,4,214,46.0,87.0,76.0,,,,,,,PRUNED,1.0792135741497835
459,0.6870020627975464,2026-04-16 09:25:40.093602,2026-04-16 09:25:41.959833,0 days 00:00:01.866231,GELU,0.003983203814126671,4,223,60.0,123.0,138.0,,,,,,,PRUNED,0.8288558757694526
460,0.10073325037956238,2026-04-16 09:25:41.960184,2026-04-16 09:25:52.839287,0 days 00:00:10.879103,GELU,0.004381132707258797,6,85,64.0,101.0,67.0,98.0,74.0,,,,,COMPLETE,0.317385019147978
461,6.265552043914795,2026-04-16 09:25:52.839648,2026-04-16 09:25:54.073966,0 days 00:00:01.234318,GELU,0.008338151928386914,6,85,67.0,106.0,69.0,97.0,84.0,,,,,PRUNED,2.5031084762580296
462,3.119495153427124,2026-04-16 09:25:54.074320,2026-04-16 09:25:55.317997,0 days 00:00:01.243677,Softplus,0.004564921843107904,7,76,64.0,100.0,56.0,80.0,75.0,28.0,,,,PRUNED,1.7662092609391233
463,0.8823658227920532,2026-04-16 09:25:55.318366,2026-04-16 09:25:55.955877,0 days 00:00:00.637511,GELU,0.0067019758750984145,2,88,71.0,,,,,,,,,PRUNED,0.939343293366197
464,0.3464176058769226,2026-04-16 09:25:55.956234,2026-04-16 09:26:07.578430,0 days 00:00:11.622196,GELU,0.005345790155686809,6,81,63.0,117.0,66.0,138.0,107.0,,,,,COMPLETE,0.588572515393747
465,1.1985249519348145,2026-04-16 09:26:07.578805,2026-04-16 09:26:20.087105,0 days 00:00:12.508300,GELU,0.004480035311730449,6,95,225.0,112.0,82.0,93.0,57.0,,,,,COMPLETE,1.094771643738919
466,1.5831212997436523,2026-04-16 09:26:20.087476,2026-04-16 09:26:21.433998,0 days 00:00:01.346522,GELU,0.0034074419185062157,6,81,72.0,103.0,62.0,109.0,94.0,,,,,PRUNED,1.2582214827857823
467,1.3163859844207764,2026-04-16 09:26:21.434351,2026-04-16 09:26:23.175700,0 days 00:00:01.741349,GELU,0.0023848529850771004,6,90,68.0,97.0,59.0,104.0,152.0,,,,,PRUNED,1.1473386528923255
468,2.9851129055023193,2026-04-16 09:26:23.176043,2026-04-16 09:26:24.298777,0 days 00:00:01.122734,ELU,0.002994895372966254,6,94,76.0,93.0,74.0,126.0,31.0,,,,,PRUNED,1.7277479288085746
469,0.8040565252304077,2026-04-16 09:26:24.299121,2026-04-16 09:26:37.060074,0 days 00:00:12.760953,GELU,0.0040901345033182235,7,86,65.0,90.0,68.0,87.0,41.0,217.0,,,,COMPLETE,0.8966919901674196
470,0.8532587885856628,2026-04-16 09:26:37.060454,2026-04-16 09:26:45.867631,0 days 00:00:08.807177,GELU,0.002256080554556878,5,71,60.0,106.0,51.0,75.0,,,,,,COMPLETE,0.923720081293929
471,0.7159151434898376,2026-04-16 09:26:45.868009,2026-04-16 09:27:02.534707,0 days 00:00:16.666698,GELU,0.0030858082844521235,8,103,122.0,99.0,79.0,171.0,71.0,143.0,151.0,,,COMPLETE,0.8461176889120317
