number,value,datetime_start,datetime_complete,duration,params_activation,params_lr,params_n_layers,params_n_units_l0,params_n_units_l1,params_n_units_l2,params_n_units_l3,params_n_units_l4,params_n_units_l5,params_n_units_l6,params_n_units_l7,params_n_units_l8,params_n_units_l9,state,RMSE
119,1.649698257446289,2026-04-16 09:00:47.105121,2026-04-16 09:00:48.397156,0 days 00:00:01.292035,GELU,0.00045173020117795923,5,156,210.0,102.0,56.0,154.0,,,,,,PRUNED,1.2844057993664966
120,0.15083374083042145,2026-04-16 09:00:48.397489,2026-04-16 09:00:56.833559,0 days 00:00:08.436070,GELU,0.0010989228517474985,4,204,69.0,88.0,69.0,,,,,,,COMPLETE,0.388373197878563
121,0.1416211575269699,2026-04-16 09:00:56.833940,2026-04-16 09:01:05.694673,0 days 00:00:08.860733,GELU,0.0011383439061357357,4,235,70.0,92.0,82.0,,,,,,,COMPLETE,0.3763258661412605
122,2.765083074569702,2026-04-16 09:01:05.695050,2026-04-16 09:01:06.678565,0 days 00:00:00.983515,GELU,0.00029584626437352665,4,237,64.0,90.0,84.0,,,,,,,PRUNED,1.6628538945348452
123,0.22299063205718994,2026-04-16 09:01:06.678915,2026-04-16 09:01:15.252027,0 days 00:00:08.573112,GELU,0.000640797745127526,4,239,69.0,77.0,72.0,,,,,,,COMPLETE,0.4722188391595468
124,0.11551568657159805,2026-04-16 09:01:15.252396,2026-04-16 09:01:25.614729,0 days 00:00:10.362333,GELU,0.0010070700483754697,5,170,79.0,90.0,66.0,173.0,,,,,,COMPLETE,0.339875987047626
125,0.6535337567329407,2026-04-16 09:01:25.615109,2026-04-16 09:01:33.959432,0 days 00:00:08.344323,GELU,0.0011729743807837975,4,169,80.0,85.0,90.0,,,,,,,COMPLETE,0.8084143471840048
126,0.18814490735530853,2026-04-16 09:01:33.959793,2026-04-16 09:01:42.454427,0 days 00:00:08.494634,GELU,0.0009566060621146498,4,230,52.0,94.0,67.0,,,,,,,COMPLETE,0.4337567375330423
127,0.10010698437690735,2026-04-16 09:01:42.454812,2026-04-16 09:01:50.666745,0 days 00:00:08.211933,GELU,0.0008896535214994049,4,225,53.0,68.0,65.0,,,,,,,COMPLETE,0.31639687795063237
128,50.42021560668945,2026-04-16 09:01:50.667110,2026-04-16 09:01:51.593096,0 days 00:00:00.925986,Softplus,0.0005971553936075672,4,224,72.0,67.0,106.0,,,,,,,PRUNED,7.100719372478358
129,3.7634551525115967,2026-04-16 09:01:51.593441,2026-04-16 09:01:52.517300,0 days 00:00:00.923859,GELU,0.00022056809653830736,4,245,55.0,74.0,60.0,,,,,,,PRUNED,1.939962667813893
130,2.689350128173828,2026-04-16 09:01:52.517664,2026-04-16 09:01:53.465762,0 days 00:00:00.948098,GELU,0.0003300631346262396,4,227,67.0,55.0,78.0,,,,,,,PRUNED,1.6399238177957622
131,1.2482508420944214,2026-04-16 09:01:53.466101,2026-04-16 09:01:54.421156,0 days 00:00:00.955055,GELU,0.0009264271583279013,4,230,48.0,95.0,64.0,,,,,,,PRUNED,1.1172514677074366
132,0.33726802468299866,2026-04-16 09:01:54.421503,2026-04-16 09:02:02.764913,0 days 00:00:08.343410,GELU,0.0011398929480745934,4,220,51.0,88.0,70.0,,,,,,,COMPLETE,0.5807478150479765
133,0.11181055754423141,2026-04-16 09:02:02.765288,2026-04-16 09:02:11.040242,0 days 00:00:08.274954,GELU,0.001535527459730887,4,242,33.0,65.0,84.0,,,,,,,COMPLETE,0.3343808570241894
134,0.33575788140296936,2026-04-16 09:02:11.040612,2026-04-16 09:02:19.405586,0 days 00:00:08.364974,GELU,0.0016236246718387194,4,250,37.0,63.0,94.0,,,,,,,COMPLETE,0.5794461850793129
135,0.9716067910194397,2026-04-16 09:02:19.405946,2026-04-16 09:02:20.670435,0 days 00:00:01.264489,GELU,0.0026805362985592223,4,245,35.0,70.0,84.0,,,,,,,PRUNED,0.9857011671999987
136,4.052725315093994,2026-04-16 09:02:20.670769,2026-04-16 09:02:21.174823,0 days 00:00:00.504054,ELU,0.0017712087954619468,2,175,58.0,,,,,,,,,PRUNED,2.0131381758572844
137,1.1762131452560425,2026-04-16 09:02:21.175151,2026-04-16 09:02:22.325643,0 days 00:00:01.150492,GELU,0.0007145033562835803,5,191,41.0,46.0,101.0,204.0,,,,,,PRUNED,1.0845336072506202
138,7.991209983825684,2026-04-16 09:02:22.325978,2026-04-16 09:02:22.668738,0 days 00:00:00.342760,GELU,0.0013401001641189538,1,208,,,,,,,,,,PRUNED,2.8268728276711856
139,1.681426763534546,2026-04-16 09:02:22.669071,2026-04-16 09:02:23.583498,0 days 00:00:00.914427,GELU,0.000510053036354264,4,242,63.0,41.0,78.0,,,,,,,PRUNED,1.2966984088578755
140,103.56209564208984,2026-04-16 09:02:23.583845,2026-04-16 09:02:23.952305,0 days 00:00:00.368460,ReLU,0.00279402057236319,2,253,27.0,,,,,,,,,PRUNED,10.176546351394949
141,0.2601262629032135,2026-04-16 09:02:23.952645,2026-04-16 09:02:32.720735,0 days 00:00:08.768090,GELU,0.0009271740054832114,4,233,51.0,98.0,66.0,,,,,,,COMPLETE,0.5100257472944023
142,0.21761931478977203,2026-04-16 09:02:32.721114,2026-04-16 09:02:41.410057,0 days 00:00:08.688943,GELU,0.0013712146814006169,4,223,70.0,82.0,54.0,,,,,,,COMPLETE,0.46649685399772206
143,0.2860148847103119,2026-04-16 09:02:41.410424,2026-04-16 09:02:49.992054,0 days 00:00:08.581630,GELU,0.0018930610606609343,4,211,77.0,94.0,39.0,,,,,,,COMPLETE,0.5348035945188775
144,0.34036824107170105,2026-04-16 09:02:49.992416,2026-04-16 09:03:01.132728,0 days 00:00:11.140312,GELU,0.0008507991049162393,5,204,57.0,102.0,88.0,178.0,,,,,,COMPLETE,0.5834108681467127
145,0.2768033444881439,2026-04-16 09:03:01.133103,2026-04-16 09:03:09.667801,0 days 00:00:08.534698,GELU,0.00265304173615728,4,230,42.0,76.0,75.0,,,,,,,COMPLETE,0.5261210359680973
146,1.6370124816894531,2026-04-16 09:03:09.668166,2026-04-16 09:03:11.070518,0 days 00:00:01.402352,GELU,0.00035936577316629303,5,236,75.0,201.0,122.0,41.0,,,,,,PRUNED,1.2794578858600438
147,5.234659194946289,2026-04-16 09:03:11.070861,2026-04-16 09:03:11.612995,0 days 00:00:00.542134,Tanh,0.0011001711846807792,3,216,32.0,104.0,,,,,,,,PRUNED,2.287937760286824
148,3.702967882156372,2026-04-16 09:03:11.613329,2026-04-16 09:03:12.568909,0 days 00:00:00.955580,GELU,0.004598725936779409,4,175,62.0,91.0,135.0,,,,,,,PRUNED,1.9243097157568925
149,0.4274681806564331,2026-04-16 09:03:12.569246,2026-04-16 09:03:19.363504,0 days 00:00:06.794258,GELU,0.0020529445940993245,3,250,48.0,81.0,,,,,,,,COMPLETE,0.6538105082181175
150,4.0052103996276855,2026-04-16 09:03:19.363879,2026-04-16 09:03:19.937680,0 days 00:00:00.573801,GELU,0.0005018018752249584,2,227,54.0,,,,,,,,,PRUNED,2.001302175991343
151,0.8895976543426514,2026-04-16 09:03:19.938026,2026-04-16 09:03:30.545277,0 days 00:00:10.607251,GELU,0.002055404155049606,5,200,84.0,116.0,52.0,152.0,,,,,,COMPLETE,0.9431848463279355
152,1.4204473495483398,2026-04-16 09:03:30.545649,2026-04-16 09:03:40.994205,0 days 00:00:10.448556,GELU,0.0013724217764067234,5,191,81.0,65.0,46.0,234.0,,,,,,COMPLETE,1.1918252177011275
153,0.325652539730072,2026-04-16 09:03:40.994574,2026-04-16 09:03:50.719839,0 days 00:00:09.725265,GELU,0.003317180926827414,5,107,72.0,87.0,63.0,178.0,,,,,,COMPLETE,0.5706597407650833
154,105.25145721435547,2026-04-16 09:03:50.720223,2026-04-16 09:03:51.706152,0 days 00:00:00.985929,GELU,3.7774216205567157e-05,4,214,90.0,122.0,57.0,,,,,,,PRUNED,10.259213284377875
155,0.19475851953029633,2026-04-16 09:03:51.706518,2026-04-16 09:04:02.203452,0 days 00:00:10.496934,GELU,0.0021052481577527224,5,221,64.0,58.0,68.0,209.0,,,,,,COMPLETE,0.44131453582484265
156,1.3571008443832397,2026-04-16 09:04:02.203833,2026-04-16 09:04:03.072518,0 days 00:00:00.868685,GELU,0.0007278810162757799,4,158,64.0,60.0,69.0,,,,,,,PRUNED,1.1649467131089042
157,4.620014190673828,2026-04-16 09:04:03.072873,2026-04-16 09:04:04.168156,0 days 00:00:01.095283,GELU,0.006831819865567351,5,33,58.0,98.0,81.0,219.0,,,,,,PRUNED,2.1494218270674157
158,2.055750846862793,2026-04-16 09:04:04.168505,2026-04-16 09:04:04.747976,0 days 00:00:00.579471,GELU,0.0010061639222536578,2,224,66.0,,,,,,,,,PRUNED,1.4337889826828747
159,1.0095548629760742,2026-04-16 09:04:04.748320,2026-04-16 09:04:20.214936,0 days 00:00:15.466616,GELU,0.0017513617778892982,6,239,77.0,73.0,103.0,206.0,225.0,,,,,COMPLETE,1.0047660737585014
160,3.8115463256835938,2026-04-16 09:04:20.215315,2026-04-16 09:04:20.952531,0 days 00:00:00.737216,Softplus,0.0036719504266997135,4,221,23.0,52.0,15.0,,,,,,,PRUNED,1.9523181927348814
161,2.222770929336548,2026-04-16 09:04:20.952874,2026-04-16 09:04:31.509769,0 days 00:00:10.556895,GELU,0.0023644698237487902,5,205,72.0,105.0,47.0,166.0,,,,,,COMPLETE,1.49089601560154
162,1873.771240234375,2026-04-16 09:04:31.510128,2026-04-16 09:04:32.753606,0 days 00:00:01.243478,GELU,3.9067756743380226e-08,5,200,86.0,178.0,34.0,193.0,,,,,,PRUNED,43.28707936826386
163,0.4855155646800995,2026-04-16 09:04:32.753953,2026-04-16 09:04:42.919868,0 days 00:00:10.165915,GELU,0.0013776138552759254,5,93,68.0,83.0,71.0,255.0,,,,,,COMPLETE,0.6967894694095911
164,0.45841118693351746,2026-04-16 09:04:42.920246,2026-04-16 09:04:51.636161,0 days 00:00:08.715915,GELU,0.002660674963958927,4,234,50.0,114.0,60.0,,,,,,,COMPLETE,0.6770606966391695
165,3.699152946472168,2026-04-16 09:04:51.636543,2026-04-16 09:04:52.815362,0 days 00:00:01.178819,GELU,0.004862790899682596,5,147,62.0,94.0,40.0,239.0,,,,,,PRUNED,1.923318212483875
166,0.31182071566581726,2026-04-16 09:04:52.815711,2026-04-16 09:05:03.086646,0 days 00:00:10.270935,GELU,0.0006360463228547535,5,229,80.0,34.0,94.0,128.0,,,,,,COMPLETE,0.5584090934662662
167,0.2947903275489807,2026-04-16 09:05:03.087021,2026-04-16 09:05:15.429823,0 days 00:00:12.342802,GELU,0.0018458241515107371,6,244,45.0,71.0,52.0,178.0,97.0,,,,,COMPLETE,0.5429459711140517
168,4.11416482925415,2026-04-16 09:05:15.430204,2026-04-16 09:05:16.250972,0 days 00:00:00.820768,ELU,0.0009339169851314703,4,219,55.0,77.0,29.0,,,,,,,PRUNED,2.028340412567415
169,1.2371435165405273,2026-04-16 09:05:16.251294,2026-04-16 09:05:17.081048,0 days 00:00:00.829754,GELU,0.0013018124209635304,4,96,30.0,128.0,75.0,,,,,,,PRUNED,1.1122695341240483
170,0.1308595836162567,2026-04-16 09:05:17.081376,2026-04-16 09:05:22.551802,0 days 00:00:05.470426,GELU,0.0036609419939863793,2,212,91.0,,,,,,,,,COMPLETE,0.3617451915592752
171,0.10880155861377716,2026-04-16 09:05:22.552165,2026-04-16 09:05:28.023262,0 days 00:00:05.471097,GELU,0.0031780919501410818,2,212,91.0,,,,,,,,,COMPLETE,0.32985081266199295
172,1.1726583242416382,2026-04-16 09:05:28.023616,2026-04-16 09:05:28.835478,0 days 00:00:00.811862,GELU,0.006002181801054952,2,204,93.0,,,,,,,,,PRUNED,1.0828934962597376
173,0.12482539564371109,2026-04-16 09:05:28.835817,2026-04-16 09:05:34.302159,0 days 00:00:05.466342,GELU,0.0032302656961014317,2,212,107.0,,,,,,,,,COMPLETE,0.3533063764549277
174,0.7164844870567322,2026-04-16 09:05:34.302527,2026-04-16 09:05:39.048235,0 days 00:00:04.745708,GELU,0.0034634150948806884,2,128,102.0,,,,,,,,,COMPLETE,0.8464540667140374
175,1.2721774578094482,2026-04-16 09:05:39.048611,2026-04-16 09:05:39.791950,0 days 00:00:00.743339,GELU,0.008466929838307413,2,215,107.0,,,,,,,,,PRUNED,1.1279084438949147
176,0.986303448677063,2026-04-16 09:05:39.792295,2026-04-16 09:05:40.530214,0 days 00:00:00.737919,GELU,0.004599672395157835,2,214,123.0,,,,,,,,,PRUNED,0.9931281129225288
177,119.7175064086914,2026-04-16 09:05:40.530569,2026-04-16 09:05:40.764807,0 days 00:00:00.234238,ReLU,0.00289301802919698,1,208,,,,,,,,,,PRUNED,10.941549543309275
178,2.418879508972168,2026-04-16 09:05:40.765137,2026-04-16 09:05:41.251479,0 days 00:00:00.486342,GELU,0.0015865987094551013,2,83,111.0,,,,,,,,,PRUNED,1.5552747374570732
179,1.817552924156189,2026-04-16 09:05:41.251815,2026-04-16 09:05:42.252585,0 days 00:00:01.000770,GELU,0.00606675371162334,2,50,95.0,,,,,,,,,PRUNED,1.3481665046114255
180,2.508960008621216,2026-04-16 09:05:42.252925,2026-04-16 09:05:42.720415,0 days 00:00:00.467490,Tanh,0.0036556216642579234,2,212,89.0,,,,,,,,,PRUNED,1.5839696994012278
181,0.9573237895965576,2026-04-16 09:05:42.720748,2026-04-16 09:05:48.016981,0 days 00:00:05.296233,GELU,0.0021868676422786143,2,222,75.0,,,,,,,,,COMPLETE,0.9784292460860712
182,1.6929267644882202,2026-04-16 09:05:48.017348,2026-04-16 09:05:48.633290,0 days 00:00:00.615942,GELU,0.0011563989734120327,2,225,104.0,,,,,,,,,PRUNED,1.301125191704557
183,0.09346920251846313,2026-04-16 09:05:48.633628,2026-04-16 09:05:54.097350,0 days 00:00:05.463722,GELU,0.0026780011407010764,2,233,83.0,,,,,,,,,COMPLETE,0.30572733361357
184,0.3316137194633484,2026-04-16 09:05:54.097701,2026-04-16 09:05:59.561488,0 days 00:00:05.463787,GELU,0.002961891556481802,2,240,82.0,,,,,,,,,COMPLETE,0.5758591142487444
185,11.397001266479492,2026-04-16 09:05:59.561857,2026-04-16 09:05:59.932090,0 days 00:00:00.370233,GELU,0.0008917657333430823,1,233,,,,,,,,,,PRUNED,3.3759444999110237
186,0.4227770268917084,2026-04-16 09:05:59.932440,2026-04-16 09:06:05.878054,0 days 00:00:05.945614,GELU,0.004254032734403413,2,194,114.0,,,,,,,,,COMPLETE,0.6502130626892298
187,1870.0892333984375,2026-04-16 09:06:05.878426,2026-04-16 09:06:06.582817,0 days 00:00:00.704391,GELU,2.64419451687565e-07,3,104,96.0,110.0,,,,,,,,PRUNED,43.24452836369519
188,1.3891347646713257,2026-04-16 09:06:06.583148,2026-04-16 09:06:07.160395,0 days 00:00:00.577247,GELU,0.0014434586777007379,2,202,86.0,,,,,,,,,PRUNED,1.1786156136210506
189,0.25833359360694885,2026-04-16 09:06:07.160741,2026-04-16 09:06:12.646536,0 days 00:00:05.485795,GELU,0.002681947042439032,2,246,80.0,,,,,,,,,COMPLETE,0.5082652787737412
190,2.1339633464813232,2026-04-16 09:06:12.646896,2026-04-16 09:06:13.371365,0 days 00:00:00.724469,GELU,0.0007535892106428172,3,92,131.0,91.0,,,,,,,,PRUNED,1.460809141017855
191,0.0910239890217781,2026-04-16 09:06:13.371701,2026-04-16 09:06:18.878984,0 days 00:00:05.507283,GELU,0.0019060887866487145,2,220,74.0,,,,,,,,,COMPLETE,0.30170182137630214
192,1.1040165424346924,2026-04-16 09:06:18.879349,2026-04-16 09:06:19.531320,0 days 00:00:00.651971,GELU,0.0018570371888068531,2,231,70.0,,,,,,,,,PRUNED,1.0507219148921814
193,1.3169386386871338,2026-04-16 09:06:19.531656,2026-04-16 09:06:20.106896,0 days 00:00:00.575240,GELU,0.0011127500853404704,2,211,75.0,,,,,,,,,PRUNED,1.1475794694430246
194,1.5534199476242065,2026-04-16 09:06:20.107231,2026-04-16 09:06:20.626839,0 days 00:00:00.519608,GELU,0.0024944593335903317,2,218,19.0,,,,,,,,,PRUNED,1.2463626870314302
195,4.317673683166504,2026-04-16 09:06:20.627168,2026-04-16 09:06:20.992012,0 days 00:00:00.364844,GELU,0.004301674527159238,1,237,,,,,,,,,,PRUNED,2.0779012688687843
196,1.8163728713989258,2026-04-16 09:06:20.992344,2026-04-16 09:06:21.471468,0 days 00:00:00.479124,GELU,0.0016441404881701134,2,89,90.0,,,,,,,,,PRUNED,1.3477287825816164
197,4.765183448791504,2026-04-16 09:06:21.471797,2026-04-16 09:06:22.539091,0 days 00:00:01.067294,Softplus,0.003134179355137851,3,230,233.0,87.0,,,,,,,,PRUNED,2.1829300146343456
198,8.193218231201172,2026-04-16 09:06:22.539437,2026-04-16 09:06:22.999468,0 days 00:00:00.460031,GELU,0.0005413349492341835,2,79,69.0,,,,,,,,,PRUNED,2.8623798195210175
199,1.5920288562774658,2026-04-16 09:06:22.999792,2026-04-16 09:06:24.503828,0 days 00:00:01.504036,GELU,0.001383023368521205,8,227,38.0,98.0,7.0,21.0,170.0,7.0,149.0,,,PRUNED,1.2617562586638775
200,0.24104145169258118,2026-04-16 09:06:24.504166,2026-04-16 09:06:33.697511,0 days 00:00:09.193345,GELU,0.0021671526082368635,4,209,81.0,104.0,112.0,,,,,,,COMPLETE,0.49095972512272446
201,1.067841649055481,2026-04-16 09:06:33.697882,2026-04-16 09:06:34.241542,0 days 00:00:00.543660,GELU,0.0020875158686826274,2,139,59.0,,,,,,,,,PRUNED,1.0333642383281323
202,0.057760659605264664,2026-04-16 09:06:34.241882,2026-04-16 09:06:42.672907,0 days 00:00:08.431025,GELU,0.0009960307224449552,4,220,65.0,61.0,87.0,,,,,,,COMPLETE,0.2403344744419008
203,0.4608076810836792,2026-04-16 09:06:42.673279,2026-04-16 09:06:51.067867,0 days 00:00:08.394588,GELU,0.0010587151473812743,4,217,74.0,51.0,87.0,,,,,,,COMPLETE,0.6788281675679636
204,0.08163799345493317,2026-04-16 09:06:51.068240,2026-04-16 09:06:59.767043,0 days 00:00:08.698803,GELU,0.0015187322153049285,4,223,67.0,80.0,94.0,,,,,,,COMPLETE,0.28572363125043254
205,2.922928810119629,2026-04-16 09:06:59.767424,2026-04-16 09:07:00.511185,0 days 00:00:00.743761,GELU,0.0015249311309652365,4,23,66.0,68.0,95.0,,,,,,,PRUNED,1.7096575125210396
206,0.24791383743286133,2026-04-16 09:07:00.511535,2026-04-16 09:07:07.419428,0 days 00:00:06.907893,GELU,0.0054730808867408595,3,224,77.0,80.0,,,,,,,,COMPLETE,0.49790946710507655
207,3.9403891563415527,2026-04-16 09:07:07.419791,2026-04-16 09:07:08.272071,0 days 00:00:00.852280,ELU,0.003471551354832075,4,99,71.0,64.0,211.0,,,,,,,PRUNED,1.985041348773761
208,0.13216102123260498,2026-04-16 09:07:08.272428,2026-04-16 09:07:16.819264,0 days 00:00:08.546836,GELU,0.0008264735109618415,4,212,61.0,75.0,107.0,,,,,,,COMPLETE,0.3635395731314611
209,150.95420837402344,2026-04-16 09:07:16.819636,2026-04-16 09:07:17.758291,0 days 00:00:00.938655,GELU,1.2089427823978552e-05,4,204,60.0,76.0,107.0,,,,,,,PRUNED,12.286342351327487
210,1.219054937362671,2026-04-16 09:07:17.758641,2026-04-16 09:07:18.673072,0 days 00:00:00.914431,GELU,0.0007013410629158541,4,211,65.0,61.0,79.0,,,,,,,PRUNED,1.1041082090821854
211,0.10461267083883286,2026-04-16 09:07:18.673433,2026-04-16 09:07:27.804783,0 days 00:00:09.131350,GELU,0.0008401058233341577,4,218,84.0,85.0,99.0,,,,,,,COMPLETE,0.3234388208592668
212,1.3149367570877075,2026-04-16 09:07:27.805144,2026-04-16 09:07:28.846314,0 days 00:00:01.041170,GELU,0.00043256387697214666,4,220,87.0,72.0,118.0,,,,,,,PRUNED,1.1467069185662515
213,0.14471498131752014,2026-04-16 09:07:28.846649,2026-04-16 09:07:37.730444,0 days 00:00:08.883795,GELU,0.0008952242820531084,4,212,83.0,85.0,100.0,,,,,,,COMPLETE,0.38041422333756153
214,0.5530641674995422,2026-04-16 09:07:37.730812,2026-04-16 09:07:46.665499,0 days 00:00:08.934687,GELU,0.0007731859716705624,4,216,83.0,89.0,98.0,,,,,,,COMPLETE,0.7436828406649855
215,0.9537380337715149,2026-04-16 09:07:46.665869,2026-04-16 09:07:47.704737,0 days 00:00:01.038868,GELU,0.000596720043029189,4,210,70.0,82.0,83.0,,,,,,,PRUNED,0.9765951227461229
216,0.6477331519126892,2026-04-16 09:07:47.705092,2026-04-16 09:07:56.220137,0 days 00:00:08.515045,GELU,0.0010598584081897003,4,214,77.0,67.0,90.0,,,,,,,COMPLETE,0.8048187074818087
217,1.63901686668396,2026-04-16 09:07:56.220503,2026-04-16 09:07:57.110484,0 days 00:00:00.889981,GELU,0.0008010193657717108,4,206,82.0,3.0,104.0,,,,,,,PRUNED,1.2802409408716626
218,75.58354187011719,2026-04-16 09:07:57.110818,2026-04-16 09:07:57.738410,0 days 00:00:00.627592,ReLU,0.0013796951405437433,4,222,92.0,100.0,111.0,,,,,,,PRUNED,8.693879563814832
219,1.647816777229309,2026-04-16 09:07:57.738751,2026-04-16 09:07:58.699384,0 days 00:00:00.960633,GELU,0.00041030389562470113,4,217,74.0,77.0,93.0,,,,,,,PRUNED,1.2836731582569252
220,0.04682343453168869,2026-04-16 09:07:58.699715,2026-04-16 09:08:07.474355,0 days 00:00:08.774640,GELU,0.0011316535454287552,4,225,61.0,91.0,99.0,,,,,,,COMPLETE,0.2163872328296859
221,0.12918061017990112,2026-04-16 09:08:07.474731,2026-04-16 09:08:16.082223,0 days 00:00:08.607492,GELU,0.001103185987744484,4,226,56.0,84.0,100.0,,,,,,,COMPLETE,0.3594170421389352
222,0.15693916380405426,2026-04-16 09:08:16.082589,2026-04-16 09:08:24.790420,0 days 00:00:08.707831,GELU,0.001074156896544777,4,225,56.0,83.0,102.0,,,,,,,COMPLETE,0.39615547933110085
223,0.874454915523529,2026-04-16 09:08:24.790780,2026-04-16 09:08:25.840097,0 days 00:00:01.049317,GELU,0.0009497275150502165,4,226,56.0,84.0,101.0,,,,,,,PRUNED,0.9351229413951564
224,1.1183820962905884,2026-04-16 09:08:25.840425,2026-04-16 09:08:26.854714,0 days 00:00:01.014289,GELU,0.0006126831918510083,4,233,59.0,90.0,98.0,,,,,,,PRUNED,1.0575358605222749
225,0.10085783898830414,2026-04-16 09:08:26.855065,2026-04-16 09:08:35.723599,0 days 00:00:08.868534,GELU,0.0011733486157722212,4,221,51.0,79.0,123.0,,,,,,,COMPLETE,0.31758123210968264
226,0.16959767043590546,2026-04-16 09:08:35.723981,2026-04-16 09:08:44.498504,0 days 00:00:08.774523,GELU,0.001247356867032088,4,219,51.0,72.0,132.0,,,,,,,COMPLETE,0.41182237728892956
227,1.0081560611724854,2026-04-16 09:08:44.498872,2026-04-16 09:08:45.469384,0 days 00:00:00.970512,GELU,0.0007291375264588518,4,213,45.0,80.0,140.0,,,,,,,PRUNED,1.0040697491571418
228,1.4988889694213867,2026-04-16 09:08:45.469720,2026-04-16 09:08:46.774767,0 days 00:00:01.305047,GELU,0.0016469415938696107,4,222,61.0,94.0,85.0,,,,,,,PRUNED,1.2242912110365682
229,0.13197769224643707,2026-04-16 09:08:46.775112,2026-04-16 09:08:55.594040,0 days 00:00:08.818928,GELU,0.0009961657295711357,4,226,65.0,75.0,127.0,,,,,,,COMPLETE,0.3632873411590845
230,1.395867109298706,2026-04-16 09:08:55.594426,2026-04-16 09:08:56.545954,0 days 00:00:00.951528,GELU,0.0005260662239442733,4,236,64.0,56.0,122.0,,,,,,,PRUNED,1.1814682007141395
231,0.11110840737819672,2026-04-16 09:08:56.546295,2026-04-16 09:09:05.305884,0 days 00:00:08.759589,GELU,0.0009823818418285626,4,228,69.0,75.0,108.0,,,,,,,COMPLETE,0.3333292777092896
232,1.1579673290252686,2026-04-16 09:09:05.306256,2026-04-16 09:09:06.287175,0 days 00:00:00.980919,GELU,0.000841811615888455,4,228,67.0,67.0,123.0,,,,,,,PRUNED,1.076088903866808
233,21.41787338256836,2026-04-16 09:09:06.287518,2026-04-16 09:09:07.093689,0 days 00:00:00.806171,Tanh,0.0013056515018549147,4,227,53.0,186.0,109.0,,,,,,,PRUNED,4.627944833570119
234,0.21838098764419556,2026-04-16 09:09:07.094041,2026-04-16 09:09:15.684830,0 days 00:00:08.590789,GELU,0.0008343897144780031,4,220,61.0,75.0,116.0,,,,,,,COMPLETE,0.4673125160363197
235,0.34727174043655396,2026-04-16 09:09:15.685194,2026-04-16 09:09:25.824602,0 days 00:00:10.139408,GELU,0.0017085262577673304,4,234,48.0,251.0,126.0,,,,,,,COMPLETE,0.5892976670890137
236,1.083355188369751,2026-04-16 09:09:25.824986,2026-04-16 09:09:34.869814,0 days 00:00:09.044828,GELU,0.0011229194105527123,4,230,84.0,72.0,141.0,,,,,,,COMPLETE,1.0408434985000152
237,0.11100262403488159,2026-04-16 09:09:34.870190,2026-04-16 09:09:45.482869,0 days 00:00:10.612679,GELU,0.0006506757381508973,4,223,167.0,62.0,114.0,,,,,,,COMPLETE,0.33317056297770603
238,0.12805283069610596,2026-04-16 09:09:45.483239,2026-04-16 09:09:54.429610,0 days 00:00:08.946371,GELU,0.000726967258686326,4,223,71.0,65.0,114.0,,,,,,,COMPLETE,0.35784470192543855
