number,value,datetime_start,datetime_complete,duration,params_activation,params_lr,params_n_layers,params_n_units_l0,params_n_units_l1,params_n_units_l2,params_n_units_l3,params_n_units_l4,params_n_units_l5,params_n_units_l6,params_n_units_l7,params_n_units_l8,params_n_units_l9,state,RMSE
0,0.33146727085113525,2026-04-16 08:53:12.912924,2026-04-16 08:53:19.510878,0 days 00:00:06.597954,Softplus,0.004826768210503866,3,70,177.0,57.0,,,,,,,,COMPLETE,0.5757319435736872
1,13.640702247619629,2026-04-16 08:53:19.511379,2026-04-16 08:53:22.119408,0 days 00:00:02.608029,Tanh,0.050678666245081064,1,198,,,,,,,,,,COMPLETE,3.693332133401981
2,1871.7027587890625,2026-04-16 08:53:22.119779,2026-04-16 08:53:40.971141,0 days 00:00:18.851362,Tanh,1.5978442544739387e-08,8,110,150.0,180.0,29.0,237.0,254.0,174.0,204.0,,,COMPLETE,43.26318017424358
3,1825.6724853515625,2026-04-16 08:53:40.971541,2026-04-16 08:53:46.046928,0 days 00:00:05.075387,GELU,2.087520736148009e-08,2,133,80.0,,,,,,,,,COMPLETE,42.72788884735077
4,81.82769775390625,2026-04-16 08:53:46.047298,2026-04-16 08:53:56.215843,0 days 00:00:10.168545,ELU,1.272039683030225e-05,5,34,122.0,51.0,201.0,156.0,,,,,,COMPLETE,9.045866335177978
5,1712.611572265625,2026-04-16 08:53:56.216237,2026-04-16 08:53:58.864844,0 days 00:00:02.648607,GELU,3.1878816377706943e-06,10,234,23.0,81.0,57.0,189.0,213.0,191.0,46.0,220.0,2.0,PRUNED,41.38371143657399
6,0.39100316166877747,2026-04-16 08:53:58.865206,2026-04-16 08:54:20.191766,0 days 00:00:21.326560,GELU,0.0002794945389993037,10,62,41.0,129.0,147.0,121.0,131.0,83.0,227.0,65.0,221.0,COMPLETE,0.6253024561512432
7,0.8647063374519348,2026-04-16 08:54:20.192207,2026-04-16 08:54:37.116089,0 days 00:00:16.923882,Softplus,0.009088151867373608,7,113,52.0,206.0,207.0,15.0,203.0,116.0,,,,COMPLETE,0.9298958745214083
8,1870.0496826171875,2026-04-16 08:54:37.116483,2026-04-16 08:54:38.015763,0 days 00:00:00.899280,Tanh,1.522164411654888e-07,4,181,196.0,102.0,50.0,,,,,,,PRUNED,43.24407106895912
9,1873.5150146484375,2026-04-16 08:54:38.016127,2026-04-16 08:54:39.357486,0 days 00:00:01.341359,Tanh,3.0529520568145927e-07,9,132,145.0,9.0,224.0,90.0,138.0,2.0,13.0,239.0,,PRUNED,43.28411965892846
10,125.81486511230469,2026-04-16 08:54:39.357833,2026-04-16 08:54:39.982947,0 days 00:00:00.625114,Softplus,0.001113363978806102,3,3,256.0,7.0,,,,,,,,PRUNED,11.216722565540465
11,143.99554443359375,2026-04-16 08:54:39.983296,2026-04-16 08:54:40.806381,0 days 00:00:00.823085,ReLU,0.0005128786450755669,6,65,4.0,148.0,128.0,77.0,4.0,,,,,PRUNED,11.999814349963659
12,130.61181640625,2026-04-16 08:54:40.806726,2026-04-16 08:54:42.282175,0 days 00:00:01.475449,Softplus,0.00016905618055480803,4,70,205.0,256.0,137.0,,,,,,,PRUNED,11.428552682043776
13,1873.673828125,2026-04-16 08:54:42.282535,2026-04-16 08:55:04.003377,0 days 00:00:21.720842,GELU,0.004874919863935455,10,69,82.0,128.0,127.0,96.0,62.0,76.0,246.0,19.0,248.0,COMPLETE,43.28595416673866
14,106.1081314086914,2026-04-16 08:55:04.003760,2026-04-16 08:55:05.349255,0 days 00:00:01.345495,ELU,5.864388696949771e-05,6,29,196.0,68.0,166.0,32.0,117.0,,,,,PRUNED,10.300880127867298
15,165.41783142089844,2026-04-16 08:55:05.349588,2026-04-16 08:55:05.563694,0 days 00:00:00.214106,ReLU,0.03808694809776688,1,86,,,,,,,,,,PRUNED,12.861486361260834
16,28.03883934020996,2026-04-16 08:55:05.564028,2026-04-16 08:55:06.256681,0 days 00:00:00.692653,Softplus,0.0014670486079866648,3,36,109.0,121.0,,,,,,,,PRUNED,5.2951713230272315
17,133.9302520751953,2026-04-16 08:55:06.257027,2026-04-16 08:55:08.148126,0 days 00:00:01.891099,GELU,9.903966533758368e-06,8,175,171.0,36.0,81.0,143.0,128.0,42.0,150.0,,,PRUNED,11.572823859162263
18,278.8174133300781,2026-04-16 08:55:08.148487,2026-04-16 08:55:09.902870,0 days 00:00:01.754383,Softplus,0.00016690828678868664,5,1,245.0,166.0,254.0,210.0,,,,,,PRUNED,16.697826604983
19,0.3115995526313782,2026-04-16 08:55:09.903244,2026-04-16 08:55:15.752998,0 days 00:00:05.849754,GELU,0.005527774803983206,3,94,56.0,95.0,,,,,,,,COMPLETE,0.5582110287618637
20,111.46722412109375,2026-04-16 08:55:15.753359,2026-04-16 08:55:16.232652,0 days 00:00:00.479293,ReLU,0.008792607244022588,3,150,94.0,90.0,,,,,,,,PRUNED,10.557803944054546
21,0.09926915913820267,2026-04-16 08:55:16.233075,2026-04-16 08:55:20.324433,0 days 00:00:04.091358,GELU,0.0030619250840796777,2,95,45.0,,,,,,,,,COMPLETE,0.31507008607324605
22,7.846870422363281,2026-04-16 08:55:20.324807,2026-04-16 08:55:20.807648,0 days 00:00:00.482841,GELU,0.08586335199190362,2,102,57.0,,,,,,,,,PRUNED,2.8012265924703916
23,0.16972358524799347,2026-04-16 08:55:20.807968,2026-04-16 08:55:24.594714,0 days 00:00:03.786746,GELU,0.0030381236937069658,2,91,25.0,,,,,,,,,COMPLETE,0.41197522407056647
24,2.2884488105773926,2026-04-16 08:55:24.595074,2026-04-16 08:55:25.625619,0 days 00:00:01.030545,GELU,0.019358224975437762,2,95,2.0,,,,,,,,,PRUNED,1.5127619808077517
25,8.628979682922363,2026-04-16 08:55:25.625951,2026-04-16 08:55:25.930788,0 days 00:00:00.304837,GELU,0.001749603017612161,1,124,,,,,,,,,,PRUNED,2.9375124991942356
26,122.00383758544922,2026-04-16 08:55:25.931106,2026-04-16 08:55:26.904329,0 days 00:00:00.973223,GELU,5.441825574187248e-05,4,153,32.0,221.0,5.0,,,,,,,PRUNED,11.045534735151994
27,0.1607246994972229,2026-04-16 08:55:26.904669,2026-04-16 08:55:30.721230,0 days 00:00:03.816561,GELU,0.0029625382834452896,2,46,63.0,,,,,,,,,COMPLETE,0.4009048509275273
28,5.781981468200684,2026-04-16 08:55:30.721587,2026-04-16 08:55:31.148568,0 days 00:00:00.426981,GELU,0.000979002378520065,2,38,71.0,,,,,,,,,PRUNED,2.4045751117818472
29,22.111726760864258,2026-04-16 08:55:31.148927,2026-04-16 08:55:31.386443,0 days 00:00:00.237516,ELU,0.002696084036135406,1,52,,,,,,,,,,PRUNED,4.702310789480451
30,23.751737594604492,2026-04-16 08:55:31.386751,2026-04-16 08:55:31.770191,0 days 00:00:00.383440,GELU,0.0003833445898982227,2,84,16.0,,,,,,,,,PRUNED,4.873575442588787
31,4.633007049560547,2026-04-16 08:55:31.770500,2026-04-16 08:55:35.070537,0 days 00:00:03.300037,GELU,0.01862542929317573,3,86,59.0,34.0,,,,,,,,PRUNED,2.152442112940682
32,1.06078040599823,2026-04-16 08:55:35.070849,2026-04-16 08:55:40.649240,0 days 00:00:05.578391,GELU,0.007189767820320358,3,53,32.0,195.0,,,,,,,,COMPLETE,1.0299419430231151
33,4.294290065765381,2026-04-16 08:55:40.649585,2026-04-16 08:55:40.942903,0 days 00:00:00.293318,GELU,0.024059669235248698,1,113,,,,,,,,,,PRUNED,2.0722668905730703
34,22.211000442504883,2026-04-16 08:55:40.943215,2026-04-16 08:55:41.297632,0 days 00:00:00.354417,GELU,0.08897193695970766,2,17,48.0,,,,,,,,,PRUNED,4.712854808129026
35,0.1494845598936081,2026-04-16 08:55:41.297916,2026-04-16 08:55:51.468048,0 days 00:00:10.170132,GELU,0.003809911279403573,4,77,102.0,254.0,85.0,,,,,,,COMPLETE,0.3866323316713284
36,9.60921859741211,2026-04-16 08:55:51.468428,2026-04-16 08:55:52.390472,0 days 00:00:00.922044,Tanh,0.0028886599031263073,4,53,96.0,254.0,99.0,,,,,,,PRUNED,3.0998739647624562
37,2.6617281436920166,2026-04-16 08:55:52.390807,2026-04-16 08:55:53.991539,0 days 00:00:01.600732,ELU,0.0007109957985670557,5,232,117.0,232.0,97.0,250.0,,,,,,PRUNED,1.6314803534495954
38,109.59876251220703,2026-04-16 08:55:53.991893,2026-04-16 08:55:54.449534,0 days 00:00:00.457641,GELU,0.00014198183253558033,2,80,72.0,,,,,,,,,PRUNED,10.468942760002417
39,1813.674072265625,2026-04-16 08:55:54.449858,2026-04-16 08:55:54.749356,0 days 00:00:00.299498,GELU,1.6397645938242536e-06,1,121,,,,,,,,,,PRUNED,42.58725246204109
40,1.2012158632278442,2026-04-16 08:55:54.749652,2026-04-16 08:56:02.841768,0 days 00:00:08.092116,GELU,0.013299844909222338,4,146,136.0,160.0,8.0,,,,,,,PRUNED,1.0959999376039418
41,0.2214464247226715,2026-04-16 08:56:02.842128,2026-04-16 08:56:09.179626,0 days 00:00:06.337498,GELU,0.0037752257895494043,3,100,97.0,108.0,,,,,,,,COMPLETE,0.47058094385840943
42,0.7673694491386414,2026-04-16 08:56:09.179998,2026-04-16 08:56:15.794819,0 days 00:00:06.614821,GELU,0.00318852331063381,3,101,97.0,150.0,,,,,,,,COMPLETE,0.8759962609159022
43,8.228131294250488,2026-04-16 08:56:15.795163,2026-04-16 08:56:16.251241,0 days 00:00:00.456078,GELU,0.044752217968157634,2,78,74.0,,,,,,,,,PRUNED,2.868471944128178
44,9.444939613342285,2026-04-16 08:56:16.251540,2026-04-16 08:56:17.118704,0 days 00:00:00.867164,Tanh,0.0006097943858107317,4,109,38.0,188.0,175.0,,,,,,,PRUNED,3.073262047620132
45,161.1405029296875,2026-04-16 08:56:17.119052,2026-04-16 08:56:17.412809,0 days 00:00:00.293757,ReLU,0.0031583442606133326,2,47,16.0,,,,,,,,,PRUNED,12.694112924095464
46,0.3430984616279602,2026-04-16 08:56:17.413107,2026-04-16 08:56:26.928172,0 days 00:00:09.515065,GELU,0.0017121924675304976,5,63,106.0,116.0,75.0,49.0,,,,,,COMPLETE,0.585746072652613
47,1874.7227783203125,2026-04-16 08:56:26.928557,2026-04-16 08:56:27.708852,0 days 00:00:00.780295,GELU,1.0864394535304575e-08,3,20,84.0,233.0,,,,,,,,PRUNED,43.29806899066415
48,115.7929458618164,2026-04-16 08:56:27.709192,2026-04-16 08:56:28.022636,0 days 00:00:00.313444,ELU,0.0003101064651824156,1,141,,,,,,,,,,PRUNED,10.760713074040048
49,1.0408034324645996,2026-04-16 08:56:28.022973,2026-04-16 08:56:33.605658,0 days 00:00:05.582685,GELU,0.009093777357189881,4,71,67.0,140.0,40.0,,,,,,,PRUNED,1.0201977418444914
50,1872.975341796875,2026-04-16 08:56:33.605979,2026-04-16 08:56:34.718014,0 days 00:00:01.112035,Tanh,5.98575925977531e-08,6,163,121.0,175.0,98.0,195.0,7.0,,,,,PRUNED,43.2778851354462
51,0.24794848263263702,2026-04-16 08:56:34.718355,2026-04-16 08:56:40.478136,0 days 00:00:05.759781,GELU,0.0057357027691272945,3,95,46.0,100.0,,,,,,,,COMPLETE,0.49794425655151103
52,0.26313865184783936,2026-04-16 08:56:40.478485,2026-04-16 08:56:46.172428,0 days 00:00:05.693943,GELU,0.004463346392144056,3,115,44.0,63.0,,,,,,,,COMPLETE,0.5129704200515263
53,2.638129949569702,2026-04-16 08:56:46.172788,2026-04-16 08:56:46.626219,0 days 00:00:00.453431,GELU,0.0012195134563350468,2,134,21.0,,,,,,,,,PRUNED,1.6242321107433204
54,3.323899030685425,2026-04-16 08:56:46.626566,2026-04-16 08:56:47.296298,0 days 00:00:00.669732,Softplus,0.031981126457338284,3,97,88.0,109.0,,,,,,,,PRUNED,1.823156337422939
55,3.4585354328155518,2026-04-16 08:56:47.296630,2026-04-16 08:56:48.245434,0 days 00:00:00.948804,GELU,0.010402297025001991,5,73,27.0,81.0,167.0,2.0,,,,,,PRUNED,1.859713804007367
56,57.95844268798828,2026-04-16 08:56:48.245769,2026-04-16 08:56:49.142723,0 days 00:00:00.896954,GELU,0.00010804765715998557,4,89,64.0,136.0,67.0,,,,,,,PRUNED,7.613044245765835
57,99.50829315185547,2026-04-16 08:56:49.143054,2026-04-16 08:56:49.510848,0 days 00:00:00.367794,ReLU,0.004978994051057947,2,106,156.0,,,,,,,,,PRUNED,9.975384361108873
58,1.4385639429092407,2026-04-16 08:56:49.511163,2026-04-16 08:56:52.089972,0 days 00:00:02.578809,GELU,0.0007946084259121279,7,127,46.0,46.0,240.0,167.0,70.0,248.0,,,,PRUNED,1.199401493624733
59,150.59817504882812,2026-04-16 08:56:52.090323,2026-04-16 08:56:52.782516,0 days 00:00:00.692193,GELU,2.17407674365565e-05,3,64,132.0,84.0,,,,,,,,PRUNED,12.271844810330194
60,34.090965270996094,2026-04-16 08:56:52.782844,2026-04-16 08:56:53.013522,0 days 00:00:00.230678,Softplus,0.0019089959902051962,1,41,,,,,,,,,,PRUNED,5.838746892184666
61,0.9247655272483826,2026-04-16 08:56:53.013775,2026-04-16 08:56:58.621195,0 days 00:00:05.607420,GELU,0.003963791289725392,3,112,41.0,63.0,,,,,,,,COMPLETE,0.9616472987787064
62,1.3609495162963867,2026-04-16 08:56:58.621527,2026-04-16 08:56:59.321871,0 days 00:00:00.700344,GELU,0.013277288574672606,2,92,53.0,,,,,,,,,PRUNED,1.1665974096904153
63,0.27785569429397583,2026-04-16 08:56:59.322216,2026-04-16 08:57:06.152114,0 days 00:00:06.829898,GELU,0.005584792127729688,4,122,15.0,70.0,117.0,,,,,,,COMPLETE,0.5271201896095196
64,0.3812468647956848,2026-04-16 08:57:06.152473,2026-04-16 08:57:10.650413,0 days 00:00:04.497940,GELU,0.0020070858745304225,2,115,79.0,,,,,,,,,COMPLETE,0.6174519129419592
65,1.2520394325256348,2026-04-16 08:57:10.650793,2026-04-16 08:57:11.716987,0 days 00:00:01.066194,GELU,0.01907538301410094,3,77,109.0,105.0,,,,,,,,PRUNED,1.1189456789878742
66,7.99407434463501,2026-04-16 08:57:11.717330,2026-04-16 08:57:12.272785,0 days 00:00:00.555455,GELU,0.00040465063235068825,3,102,38.0,21.0,,,,,,,,PRUNED,2.8273794129255116
67,10.877768516540527,2026-04-16 08:57:12.273086,2026-04-16 08:57:12.782540,0 days 00:00:00.509454,ELU,0.0011235648491174411,3,134,10.0,47.0,,,,,,,,PRUNED,3.298146224250909
68,186.9027862548828,2026-04-16 08:57:12.782868,2026-04-16 08:57:13.068902,0 days 00:00:00.286034,ReLU,0.005587297783382296,2,26,28.0,,,,,,,,,PRUNED,13.671239382546222
69,13.217937469482422,2026-04-16 08:57:13.069202,2026-04-16 08:57:13.780071,0 days 00:00:00.710869,GELU,0.00025513939048431663,4,58,60.0,70.0,21.0,,,,,,,PRUNED,3.63564814984652
70,1716.4813232421875,2026-04-16 08:57:13.780381,2026-04-16 08:57:14.235807,0 days 00:00:00.455426,GELU,5.556610746854618e-06,1,256,,,,,,,,,,PRUNED,41.43043957336426
71,1.1946371793746948,2026-04-16 08:57:14.236138,2026-04-16 08:57:20.882624,0 days 00:00:06.646486,GELU,0.0074400525979120575,4,118,11.0,58.0,115.0,,,,,,,COMPLETE,1.092994592564252
72,0.4010121524333954,2026-04-16 08:57:20.882976,2026-04-16 08:57:30.434841,0 days 00:00:09.551865,GELU,0.004465218372667689,5,91,47.0,74.0,151.0,60.0,,,,,,COMPLETE,0.6332552032422595
73,0.34792807698249817,2026-04-16 08:57:30.435221,2026-04-16 08:57:35.617274,0 days 00:00:05.182053,GELU,0.002460559890682684,3,83,24.0,101.0,,,,,,,,COMPLETE,0.5898542845334754
74,2.6339149475097656,2026-04-16 08:57:35.617615,2026-04-16 08:57:36.596440,0 days 00:00:00.978825,GELU,0.050778985447864355,4,124,37.0,119.0,186.0,,,,,,,PRUNED,1.622934055194408
75,5.790263652801514,2026-04-16 08:57:36.596770,2026-04-16 08:57:37.013562,0 days 00:00:00.416792,Tanh,0.006716349599572702,3,106,5.0,23.0,,,,,,,,PRUNED,2.4062966676620556
76,5.579536437988281,2026-04-16 08:57:37.013870,2026-04-16 08:57:37.470233,0 days 00:00:00.456363,GELU,0.02757295844160952,2,139,20.0,,,,,,,,,PRUNED,2.362104239441664
77,1873.673828125,2026-04-16 08:57:37.470566,2026-04-16 08:57:40.202743,0 days 00:00:02.732177,GELU,0.05969111062856193,9,97,51.0,90.0,110.0,223.0,195.0,226.0,92.0,137.0,,PRUNED,43.28595416673866
78,0.4634084403514862,2026-04-16 08:57:40.203091,2026-04-16 08:57:45.376374,0 days 00:00:05.173283,GELU,0.003695534120252073,3,118,32.0,56.0,,,,,,,,COMPLETE,0.6807410964173429
79,2.6353321075439453,2026-04-16 08:57:45.376726,2026-04-16 08:57:46.200593,0 days 00:00:00.823867,Softplus,0.014915604160855139,4,85,102.0,78.0,82.0,,,,,,,PRUNED,1.6233706008006752
80,12.759284019470215,2026-04-16 08:57:46.200961,2026-04-16 08:57:46.641272,0 days 00:00:00.440311,GELU,0.0005382738360326035,2,45,88.0,,,,,,,,,PRUNED,3.572014000458315
81,0.24478717148303986,2026-04-16 08:57:46.641596,2026-04-16 08:57:52.508359,0 days 00:00:05.866763,GELU,0.0015643900631790103,3,99,59.0,94.0,,,,,,,,COMPLETE,0.4947597108526925
82,0.15782374143600464,2026-04-16 08:57:52.508711,2026-04-16 08:57:58.591050,0 days 00:00:06.082339,GELU,0.0014845747360919244,3,103,76.0,94.0,,,,,,,,COMPLETE,0.3972703631483283
83,1.4546297788619995,2026-04-16 08:57:58.591414,2026-04-16 08:57:59.266643,0 days 00:00:00.675229,GELU,0.0011240171636065033,3,102,78.0,95.0,,,,,,,,PRUNED,1.206080336819235
84,1.5724081993103027,2026-04-16 08:57:59.266975,2026-04-16 08:57:59.712636,0 days 00:00:00.445661,GELU,0.0024909156186645985,2,73,67.0,,,,,,,,,PRUNED,1.2539570165321867
85,0.0575115941464901,2026-04-16 08:57:59.712963,2026-04-16 08:58:05.626866,0 days 00:00:05.913903,GELU,0.0013591405791627891,3,96,59.0,111.0,,,,,,,,COMPLETE,0.23981575041370842
86,8.758650779724121,2026-04-16 08:58:05.627203,2026-04-16 08:58:06.058065,0 days 00:00:00.430862,ELU,0.0016436963664526283,2,94,59.0,,,,,,,,,PRUNED,2.959501778969582
87,4.807025909423828,2026-04-16 08:58:06.058389,2026-04-16 08:58:06.528790,0 days 00:00:00.470401,GELU,0.0007677553816536634,2,80,91.0,,,,,,,,,PRUNED,2.1924930808154968
88,1.6954964399337769,2026-04-16 08:58:06.529108,2026-04-16 08:58:12.828318,0 days 00:00:06.299210,GELU,0.011053748748800187,3,106,73.0,128.0,,,,,,,,COMPLETE,1.302112299279051
89,179.12289428710938,2026-04-16 08:58:12.828680,2026-04-16 08:58:13.046570,0 days 00:00:00.217890,ReLU,0.0015576570197537308,1,66,,,,,,,,,,PRUNED,13.38368014737013
90,43.55747604370117,2026-04-16 08:58:13.046878,2026-04-16 08:58:13.583603,0 days 00:00:00.536725,Tanh,0.00020468803880819729,3,56,65.0,112.0,,,,,,,,PRUNED,6.599808788419645
91,1.5306051969528198,2026-04-16 08:58:13.583917,2026-04-16 08:58:19.414427,0 days 00:00:05.830510,GELU,0.00326229759808144,3,98,44.0,101.0,,,,,,,,COMPLETE,1.2371762998670883
92,1843.7552490234375,2026-04-16 08:58:19.414804,2026-04-16 08:58:20.069951,0 days 00:00:00.655147,GELU,1.357475262007469e-06,3,110,54.0,89.0,,,,,,,,PRUNED,42.93897121524266
93,0.8216975927352905,2026-04-16 08:58:20.070283,2026-04-16 08:58:26.083387,0 days 00:00:06.013104,GELU,0.008642205200248316,3,89,61.0,125.0,,,,,,,,COMPLETE,0.9064753679694173
94,0.09857133775949478,2026-04-16 08:58:26.083745,2026-04-16 08:58:34.977218,0 days 00:00:08.893473,GELU,0.0009224674284898889,4,205,83.0,112.0,32.0,,,,,,,COMPLETE,0.31396072646032464
95,38.50646209716797,2026-04-16 08:58:34.977599,2026-04-16 08:58:35.743488,0 days 00:00:00.765889,GELU,0.00040947059080800733,4,8,83.0,134.0,35.0,,,,,,,PRUNED,6.205357531775906
96,0.3233335018157959,2026-04-16 08:58:35.743800,2026-04-16 08:58:45.523690,0 days 00:00:09.779890,GELU,0.000872621116705301,4,208,116.0,149.0,55.0,,,,,,,COMPLETE,0.5686242184569664
97,1.6885331869125366,2026-04-16 08:58:45.524079,2026-04-16 08:58:46.103081,0 days 00:00:00.579002,GELU,0.0011776872194250248,2,197,75.0,,,,,,,,,PRUNED,1.2994357186534995
98,0.23297780752182007,2026-04-16 08:58:46.103423,2026-04-16 08:58:55.280897,0 days 00:00:09.177474,GELU,0.0022845475332669085,5,73,103.0,115.0,25.0,111.0,,,,,,COMPLETE,0.48267774707543754
99,2.2457451820373535,2026-04-16 08:58:55.281253,2026-04-16 08:59:04.615425,0 days 00:00:09.334172,GELU,0.0021652630397355323,5,76,112.0,113.0,22.0,127.0,,,,,,COMPLETE,1.49858105621196
100,2.7192769050598145,2026-04-16 08:59:04.615799,2026-04-16 08:59:05.747659,0 days 00:00:01.131860,GELU,0.0005545854785790253,5,70,100.0,161.0,43.0,111.0,,,,,,PRUNED,1.64902301532144
101,0.3610631823539734,2026-04-16 08:59:05.748021,2026-04-16 08:59:17.265315,0 days 00:00:11.517294,GELU,0.002725449607356084,6,85,85.0,97.0,64.0,171.0,54.0,,,,,COMPLETE,0.6008853321175126
102,49.61809158325195,2026-04-16 08:59:17.265689,2026-04-16 08:59:18.476908,0 days 00:00:01.211219,GELU,8.752792861055585e-05,6,101,93.0,121.0,19.0,62.0,167.0,,,,,PRUNED,7.044011043663401
103,0.08346053957939148,2026-04-16 08:59:18.477256,2026-04-16 08:59:27.940566,0 days 00:00:09.463310,GELU,0.0014176602994353134,5,90,70.0,105.0,52.0,146.0,,,,,,COMPLETE,0.2888953782589668
104,14.7822847366333,2026-04-16 08:59:27.940935,2026-04-16 08:59:28.954516,0 days 00:00:01.013581,Softplus,0.0013752254939274752,5,60,69.0,140.0,48.0,139.0,,,,,,PRUNED,3.844773691211656
105,0.21302959322929382,2026-04-16 08:59:28.954873,2026-04-16 08:59:38.267874,0 days 00:00:09.313001,GELU,0.0037397978635938115,5,87,101.0,110.0,29.0,106.0,,,,,,COMPLETE,0.46155128992268435
106,1.1730928421020508,2026-04-16 08:59:38.268248,2026-04-16 08:59:39.702269,0 days 00:00:01.434021,GELU,0.0033773775101184336,5,90,124.0,110.0,32.0,102.0,,,,,,PRUNED,1.0830941058384773
107,1.9700430631637573,2026-04-16 08:59:39.702608,2026-04-16 08:59:40.724992,0 days 00:00:01.022384,GELU,0.0007422176591016275,5,81,98.0,108.0,2.0,146.0,,,,,,PRUNED,1.4035822252948906
108,4.169254779815674,2026-04-16 08:59:40.725323,2026-04-16 08:59:42.119520,0 days 00:00:01.394197,ELU,0.004494768224917052,6,66,144.0,133.0,60.0,118.0,252.0,,,,,PRUNED,2.0418753095661044
109,0.1654665321111679,2026-04-16 08:59:42.119860,2026-04-16 08:59:51.284918,0 days 00:00:09.165058,GELU,0.0023959541752357565,5,166,107.0,85.0,15.0,82.0,,,,,,COMPLETE,0.4067757762099016
110,0.7649374604225159,2026-04-16 08:59:51.285306,2026-04-16 09:00:01.813923,0 days 00:00:10.528617,GELU,0.0009452594596213868,6,182,81.0,85.0,12.0,76.0,91.0,,,,,COMPLETE,0.8746070319992378
111,0.9954596161842346,2026-04-16 09:00:01.814294,2026-04-16 09:00:11.837346,0 days 00:00:10.023052,GELU,0.002192655825436785,5,165,116.0,119.0,26.0,87.0,,,,,,COMPLETE,0.9977272253397893
112,36.607383728027344,2026-04-16 09:00:11.837726,2026-04-16 09:00:22.505253,0 days 00:00:10.667527,GELU,0.0068718985120337995,5,217,107.0,107.0,36.0,108.0,,,,,,COMPLETE,6.050403600424301
113,0.21182101964950562,2026-04-16 09:00:22.505628,2026-04-16 09:00:33.246799,0 days 00:00:10.741171,GELU,0.0021241261450481537,5,199,87.0,125.0,49.0,155.0,,,,,,COMPLETE,0.4602401760488817
114,0.3468836545944214,2026-04-16 09:00:33.247172,2026-04-16 09:00:42.263881,0 days 00:00:09.016709,GELU,0.003533016765017591,4,184,90.0,144.0,73.0,,,,,,,COMPLETE,0.5889682967651326
115,92.41973876953125,2026-04-16 09:00:42.264252,2026-04-16 09:00:43.216289,0 days 00:00:00.952037,ReLU,0.0015711957603454006,7,195,97.0,126.0,50.0,161.0,30.0,149.0,,,,PRUNED,9.613518542632102
116,1.2974213361740112,2026-04-16 09:00:43.216623,2026-04-16 09:00:44.577275,0 days 00:00:01.360652,GELU,0.009945857415967494,4,216,76.0,214.0,13.0,,,,,,,PRUNED,1.1390440448788675
117,10.851245880126953,2026-04-16 09:00:44.577599,2026-04-16 09:00:45.535701,0 days 00:00:00.958102,Tanh,0.005171969521513869,5,209,86.0,80.0,90.0,186.0,,,,,,PRUNED,3.294122930330159
118,4.616373062133789,2026-04-16 09:00:45.536046,2026-04-16 09:00:47.104776,0 days 00:00:01.568730,GELU,0.015929781296064947,6,187,94.0,242.0,43.0,133.0,167.0,,,,,PRUNED,2.1485746582638896
