number,value,datetime_start,datetime_complete,duration,params_activation,params_lr,params_n_layers,params_n_units_l0,params_n_units_l1,params_n_units_l2,params_n_units_l3,params_n_units_l4,params_n_units_l5,params_n_units_l6,params_n_units_l7,params_n_units_l8,params_n_units_l9,state,RMSE
239,1.5883598327636719,2026-04-16 09:09:54.429987,2026-04-16 09:09:55.447401,0 days 00:00:01.017414,GELU,0.000501689189298518,4,223,70.0,62.0,114.0,,,,,,,PRUNED,1.2603014848692642
240,0.3123946785926819,2026-04-16 09:09:55.447753,2026-04-16 09:10:06.458259,0 days 00:00:11.010506,GELU,0.0007230104462370307,4,226,186.0,57.0,128.0,,,,,,,COMPLETE,0.5589227841058922
241,2.1896073818206787,2026-04-16 09:10:06.458626,2026-04-16 09:10:07.416127,0 days 00:00:00.957501,GELU,0.0003112323108464119,4,217,65.0,67.0,109.0,,,,,,,PRUNED,1.4797321993592891
242,0.2501372694969177,2026-04-16 09:10:07.416459,2026-04-16 09:10:18.123789,0 days 00:00:10.707330,GELU,0.0008911102839634687,4,239,148.0,75.0,118.0,,,,,,,COMPLETE,0.5001372506591742
243,0.9788738489151001,2026-04-16 09:10:18.124165,2026-04-16 09:10:27.192387,0 days 00:00:09.068222,GELU,0.0011957847341265864,4,213,78.0,80.0,151.0,,,,,,,COMPLETE,0.9893805379706537
244,1.2971789836883545,2026-04-16 09:10:27.192753,2026-04-16 09:10:28.126354,0 days 00:00:00.933601,GELU,0.0006473616652147853,4,220,73.0,49.0,104.0,,,,,,,PRUNED,1.1389376557513384
245,0.08286835998296738,2026-04-16 09:10:28.126696,2026-04-16 09:10:47.045987,0 days 00:00:18.919291,GELU,0.0016830479013946436,9,232,161.0,69.0,93.0,95.0,32.0,109.0,79.0,131.0,,COMPLETE,0.2878686505734297
246,1.2918617725372314,2026-04-16 09:10:47.046364,2026-04-16 09:10:49.156259,0 days 00:00:02.109895,GELU,0.0017744753182985784,9,233,177.0,42.0,89.0,98.0,41.0,118.0,82.0,142.0,,PRUNED,1.1366009733135158
247,0.46764886379241943,2026-04-16 09:10:49.156601,2026-04-16 09:11:04.398110,0 days 00:00:15.241509,GELU,0.0014951435940703769,7,229,153.0,66.0,97.0,60.0,89.0,71.0,,,,COMPLETE,0.6838485678806525
248,5.700279235839844,2026-04-16 09:11:04.398488,2026-04-16 09:11:06.435863,0 days 00:00:02.037375,Softplus,0.0020957354227574437,9,241,159.0,62.0,106.0,75.0,24.0,148.0,113.0,86.0,,PRUNED,2.3875257560578995
249,0.16252654790878296,2026-04-16 09:11:06.436226,2026-04-16 09:11:17.141370,0 days 00:00:10.705144,GELU,0.0012016241805672453,4,225,168.0,70.0,114.0,,,,,,,COMPLETE,0.4031458146983334
250,0.20024359226226807,2026-04-16 09:11:17.141737,2026-04-16 09:11:27.576742,0 days 00:00:10.435005,GELU,0.0018398963964686434,4,235,166.0,59.0,93.0,,,,,,,COMPLETE,0.4474858570527878
251,0.11606761068105698,2026-04-16 09:11:27.577114,2026-04-16 09:11:36.304982,0 days 00:00:08.727868,GELU,0.000995534369184231,4,223,56.0,76.0,131.0,,,,,,,COMPLETE,0.34068696875732857
252,0.9480448365211487,2026-04-16 09:11:36.305360,2026-04-16 09:11:37.489554,0 days 00:00:01.184194,GELU,0.0005509367382679435,4,222,164.0,77.0,119.0,,,,,,,PRUNED,0.973675940198354
253,1.0232089757919312,2026-04-16 09:11:37.489896,2026-04-16 09:11:38.643742,0 days 00:00:01.153846,GELU,0.000877676682905404,4,220,172.0,54.0,127.0,,,,,,,PRUNED,1.011537926027458
254,1.6808030605316162,2026-04-16 09:11:38.644091,2026-04-16 09:11:39.609574,0 days 00:00:00.965483,GELU,0.000433471175113623,4,228,54.0,71.0,135.0,,,,,,,PRUNED,1.2964578899955124
255,1.5437283515930176,2026-04-16 09:11:39.609930,2026-04-16 09:11:47.133677,0 days 00:00:07.523747,GELU,0.002403031496887854,3,216,141.0,63.0,,,,,,,,COMPLETE,1.2424686521570745
256,0.5179627537727356,2026-04-16 09:11:47.134056,2026-04-16 09:12:03.684430,0 days 00:00:16.550374,GELU,0.001560926150071246,8,224,57.0,78.0,131.0,120.0,74.0,202.0,46.0,,,COMPLETE,0.7196962927323828
257,3.711390495300293,2026-04-16 09:12:03.684801,2026-04-16 09:12:04.565691,0 days 00:00:00.880890,ELU,0.0007299206793128567,4,217,63.0,68.0,111.0,,,,,,,PRUNED,1.9264969492060695
258,0.16649603843688965,2026-04-16 09:12:04.566039,2026-04-16 09:12:13.175877,0 days 00:00:08.609838,GELU,0.0011584571077974401,4,229,42.0,85.0,121.0,,,,,,,COMPLETE,0.4080392609013128
259,1.235715627670288,2026-04-16 09:12:13.176244,2026-04-16 09:12:13.788229,0 days 00:00:00.611985,GELU,0.0025311020663432012,2,209,52.0,,,,,,,,,PRUNED,1.1116274680261766
260,1873.508056640625,2026-04-16 09:12:13.788581,2026-04-16 09:12:16.135298,0 days 00:00:02.346717,GELU,9.068837646251999e-07,10,225,58.0,73.0,106.0,140.0,110.0,41.0,174.0,174.0,88.0,PRUNED,43.28403928286529
261,87.03422546386719,2026-04-16 09:12:16.135654,2026-04-16 09:12:16.719114,0 days 00:00:00.583460,ReLU,0.0013763128388955767,4,219,47.0,80.0,143.0,,,,,,,PRUNED,9.329213550126676
262,1.7298834323883057,2026-04-16 09:12:16.719460,2026-04-16 09:12:17.471914,0 days 00:00:00.752454,GELU,0.0006656719903612792,3,232,67.0,59.0,,,,,,,,PRUNED,1.3152503306930987
263,0.283308207988739,2026-04-16 09:12:17.472253,2026-04-16 09:12:27.789495,0 days 00:00:10.317242,GELU,0.0009000977067678338,4,215,160.0,74.0,93.0,,,,,,,COMPLETE,0.5322670457474697
264,1.0678030252456665,2026-04-16 09:12:27.789868,2026-04-16 09:12:42.356138,0 days 00:00:14.566270,GELU,0.002003850971079696,7,222,62.0,65.0,114.0,68.0,148.0,144.0,,,,COMPLETE,1.03334554977784
265,3.3225831985473633,2026-04-16 09:12:42.356519,2026-04-16 09:12:43.266133,0 days 00:00:00.909614,Tanh,0.001138459873378195,4,212,184.0,86.0,100.0,,,,,,,PRUNED,1.8227954351894136
266,0.7166483998298645,2026-04-16 09:12:43.266492,2026-04-16 09:12:44.315940,0 days 00:00:01.049448,GELU,0.0029701460333788855,2,247,73.0,,,,,,,,,PRUNED,0.8465508843713203
267,0.14460091292858124,2026-04-16 09:12:44.316273,2026-04-16 09:12:52.979526,0 days 00:00:08.663253,GELU,0.0016914620460697929,4,239,59.0,51.0,150.0,,,,,,,COMPLETE,0.38026426722554574
268,4.976132392883301,2026-04-16 09:12:52.979905,2026-04-16 09:12:53.557597,0 days 00:00:00.577692,GELU,0.00039224492255817973,2,230,50.0,,,,,,,,,PRUNED,2.2307246340333675
269,1.9085863828659058,2026-04-16 09:12:53.557945,2026-04-16 09:12:54.306919,0 days 00:00:00.748974,GELU,0.0005740180910055158,3,207,66.0,69.0,,,,,,,,PRUNED,1.3815159727147224
270,0.11741285026073456,2026-04-16 09:12:54.307257,2026-04-16 09:13:02.987696,0 days 00:00:08.680439,GELU,0.0009332587498479902,4,226,79.0,79.0,88.0,,,,,,,COMPLETE,0.34265558548013564
271,0.125845804810524,2026-04-16 09:13:02.988063,2026-04-16 09:13:11.941358,0 days 00:00:08.953295,GELU,0.0013274470096551957,4,225,80.0,106.0,84.0,,,,,,,COMPLETE,0.35474752262774717
272,0.6776755452156067,2026-04-16 09:13:11.941726,2026-04-16 09:13:20.971257,0 days 00:00:09.029531,GELU,0.00153544590718379,4,234,79.0,118.0,76.0,,,,,,,COMPLETE,0.8232105108753208
273,0.24676349759101868,2026-04-16 09:13:20.971628,2026-04-16 09:13:30.014830,0 days 00:00:09.043202,GELU,0.0022193864289879544,4,221,89.0,107.0,87.0,,,,,,,COMPLETE,0.4967529542851443
274,0.1149221807718277,2026-04-16 09:13:30.015211,2026-04-16 09:13:49.012374,0 days 00:00:18.997163,GELU,0.003080819419534911,10,224,84.0,100.0,81.0,90.0,47.0,111.0,1.0,186.0,149.0,COMPLETE,0.33900174154689483
275,0.29583871364593506,2026-04-16 09:13:49.012751,2026-04-16 09:14:08.112345,0 days 00:00:19.099594,GELU,0.0012804425761873148,10,228,80.0,100.0,81.0,92.0,45.0,98.0,5.0,185.0,142.0,COMPLETE,0.5439105750451402
276,2.6998982429504395,2026-04-16 09:14:08.112720,2026-04-16 09:14:09.888283,0 days 00:00:01.775563,GELU,0.0028161182777538462,9,237,79.0,105.0,91.0,48.0,20.0,44.0,48.0,99.0,,PRUNED,1.6431367085396271
277,0.6231510639190674,2026-04-16 09:14:09.888634,2026-04-16 09:14:19.564523,0 days 00:00:09.675889,GELU,0.001958490130431898,3,223,211.0,97.0,,,,,,,,COMPLETE,0.7893991790716959
278,684.8705444335938,2026-04-16 09:14:19.564889,2026-04-16 09:14:21.788257,0 days 00:00:02.223368,Softplus,4.395685096231307e-06,10,231,85.0,115.0,85.0,115.0,35.0,101.0,74.0,200.0,154.0,PRUNED,26.17003141827678
279,1.388934850692749,2026-04-16 09:14:21.788611,2026-04-16 09:14:22.959200,0 days 00:00:01.170589,GELU,0.0014849384419833985,4,225,77.0,111.0,77.0,,,,,,,PRUNED,1.1785308017581675
280,1.2918016910552979,2026-04-16 09:14:22.959550,2026-04-16 09:14:25.204592,0 days 00:00:02.245042,GELU,0.001110105860383789,10,217,72.0,99.0,97.0,134.0,78.0,171.0,29.0,158.0,73.0,PRUNED,1.1365745426743017
281,3.3777599334716797,2026-04-16 09:14:25.204938,2026-04-16 09:14:27.787181,0 days 00:00:02.582243,GELU,0.000728174847739248,10,232,86.0,90.0,82.0,126.0,51.0,126.0,113.0,252.0,202.0,PRUNED,1.8378683123313486
282,0.3700413703918457,2026-04-16 09:14:27.787537,2026-04-16 09:14:38.482785,0 days 00:00:10.695248,GELU,0.001999327547532755,4,222,175.0,92.0,88.0,,,,,,,COMPLETE,0.6083102583319188
283,2.871941566467285,2026-04-16 09:14:38.483152,2026-04-16 09:14:39.382501,0 days 00:00:00.899349,ELU,0.0009762718165717136,4,242,73.0,82.0,71.0,,,,,,,PRUNED,1.6946803729515738
284,40.270328521728516,2026-04-16 09:14:39.382851,2026-04-16 09:14:40.469221,0 days 00:00:01.086370,GELU,7.333907386182719e-05,5,228,42.0,109.0,95.0,3.0,,,,,,PRUNED,6.345890679938358
285,1.4572502374649048,2026-04-16 09:14:40.469574,2026-04-16 09:14:42.608229,0 days 00:00:02.138655,GELU,0.002857072522195105,8,219,77.0,87.0,78.0,84.0,2.0,55.0,69.0,,,PRUNED,1.207166201260168
286,0.13188156485557556,2026-04-16 09:14:42.608573,2026-04-16 09:14:51.637823,0 days 00:00:09.029250,GELU,0.0014570710384151301,4,226,82.0,103.0,64.0,,,,,,,COMPLETE,0.36315501491178054
287,3.7050845623016357,2026-04-16 09:14:51.638196,2026-04-16 09:14:53.480272,0 days 00:00:01.842076,GELU,0.00024192292605650223,9,237,34.0,96.0,100.0,99.0,107.0,97.0,5.0,113.0,,PRUNED,1.9248596214533764
288,80.47628021240234,2026-04-16 09:14:53.480617,2026-04-16 09:14:54.324667,0 days 00:00:00.844050,ReLU,0.0006267736709072579,6,218,95.0,80.0,87.0,144.0,63.0,,,,,PRUNED,8.970857272992495
289,3.3407113552093506,2026-04-16 09:14:54.325019,2026-04-16 09:14:55.638228,0 days 00:00:01.313209,GELU,0.0036379713899372702,4,232,87.0,63.0,92.0,,,,,,,PRUNED,1.827761296014704
290,0.42650508880615234,2026-04-16 09:14:55.638571,2026-04-16 09:15:04.179553,0 days 00:00:08.540982,GELU,0.0009459149137713703,4,225,69.0,91.0,60.0,,,,,,,COMPLETE,0.6530735707454041
291,0.22973968088626862,2026-04-16 09:15:04.179937,2026-04-16 09:15:13.624601,0 days 00:00:09.444664,GELU,0.0017861707903540744,5,216,74.0,56.0,72.0,32.0,,,,,,COMPLETE,0.47931167405589925
292,5.149962902069092,2026-04-16 09:15:13.624971,2026-04-16 09:15:14.250873,0 days 00:00:00.625902,Tanh,0.0004757178134932761,3,244,55.0,86.0,,,,,,,,PRUNED,2.2693529699165556
293,0.1764989048242569,2026-04-16 09:15:14.251244,2026-04-16 09:15:23.793383,0 days 00:00:09.542139,GELU,0.0013026914021220237,4,222,81.0,70.0,244.0,,,,,,,COMPLETE,0.42011772733872693
294,1.6994081735610962,2026-04-16 09:15:23.793762,2026-04-16 09:15:24.755964,0 days 00:00:00.962202,GELU,0.002771945189156814,4,230,47.0,103.0,104.0,,,,,,,PRUNED,1.3036135062053846
295,0.7862430214881897,2026-04-16 09:15:24.756310,2026-04-16 09:15:26.165246,0 days 00:00:01.408936,GELU,0.000938691111064246,4,252,69.0,123.0,96.0,,,,,,,PRUNED,0.8867034574694009
296,0.6434110403060913,2026-04-16 09:15:26.165590,2026-04-16 09:15:35.057209,0 days 00:00:08.891619,GELU,0.004311947948027814,4,236,89.0,78.0,84.0,,,,,,,COMPLETE,0.8021290671120772
297,1.7930500507354736,2026-04-16 09:15:35.057592,2026-04-16 09:15:35.853753,0 days 00:00:00.796161,GELU,0.0021826997923056145,3,227,75.0,113.0,,,,,,,,PRUNED,1.339048188354502
298,130.4629669189453,2026-04-16 09:15:35.854109,2026-04-16 09:15:36.807071,0 days 00:00:00.952962,GELU,2.208639566575069e-05,4,221,54.0,94.0,90.0,,,,,,,PRUNED,11.422038649862174
299,1.4025424718856812,2026-04-16 09:15:36.807424,2026-04-16 09:15:37.955130,0 days 00:00:01.147706,GELU,0.0006268486066220518,5,215,62.0,65.0,75.0,163.0,,,,,,PRUNED,1.1842898597411367
300,7.3151021003723145,2026-04-16 09:15:37.955476,2026-04-16 09:15:38.323539,0 days 00:00:00.368063,GELU,0.001370667012846181,1,231,,,,,,,,,,PRUNED,2.7046445423331167
301,1.8505802154541016,2026-04-16 09:15:38.323890,2026-04-16 09:15:39.257274,0 days 00:00:00.933384,GELU,0.0008124089488921902,4,219,40.0,83.0,110.0,,,,,,,PRUNED,1.360360325595429
302,5.737096309661865,2026-04-16 09:15:39.257611,2026-04-16 09:15:40.275752,0 days 00:00:01.018141,Softplus,0.0017054594435231757,4,240,127.0,45.0,164.0,,,,,,,PRUNED,2.3952236450197852
303,1.0598684549331665,2026-04-16 09:15:40.276092,2026-04-16 09:15:40.852205,0 days 00:00:00.576113,GELU,0.0011594343976834794,2,207,69.0,,,,,,,,,PRUNED,1.029499128184753
304,1.3699705600738525,2026-04-16 09:15:40.852548,2026-04-16 09:15:42.038991,0 days 00:00:01.186443,GELU,0.0003655696307772268,5,227,84.0,71.0,103.0,52.0,,,,,,PRUNED,1.1704574148912263
305,0.3494259715080261,2026-04-16 09:15:42.039351,2026-04-16 09:15:47.557609,0 days 00:00:05.518258,GELU,0.0024342221737016947,2,224,98.0,,,,,,,,,COMPLETE,0.5911226366059975
306,0.12291572988033295,2026-04-16 09:15:47.557978,2026-04-16 09:15:56.018980,0 days 00:00:08.461002,GELU,0.0009736941518260878,4,212,78.0,54.0,97.0,,,,,,,COMPLETE,0.3505933968008139
307,1.1743539571762085,2026-04-16 09:15:56.019348,2026-04-16 09:15:56.934590,0 days 00:00:00.915242,GELU,0.0005960423076353845,4,198,79.0,52.0,80.0,,,,,,,PRUNED,1.0836761311278422
308,3.452033042907715,2026-04-16 09:15:56.934944,2026-04-16 09:15:57.790959,0 days 00:00:00.856015,ELU,0.0008330214123020118,4,211,92.0,39.0,67.0,,,,,,,PRUNED,1.8579647582523504
309,1.7434320449829102,2026-04-16 09:15:57.791302,2026-04-16 09:15:58.697516,0 days 00:00:00.906214,GELU,0.004924053080248104,3,214,135.0,59.0,,,,,,,,PRUNED,1.3203908682594372
310,2.031705617904663,2026-04-16 09:15:58.697861,2026-04-16 09:16:00.507373,0 days 00:00:01.809512,GELU,0.0017056701353402495,9,201,76.0,47.0,119.0,199.0,12.0,26.0,107.0,48.0,,PRUNED,1.4253791137464669
311,5.658339977264404,2026-04-16 09:16:00.507720,2026-04-16 09:16:01.456450,0 days 00:00:00.948730,GELU,0.0001553028749823876,4,218,84.0,59.0,95.0,,,,,,,PRUNED,2.3787265452893918
312,7.832808017730713,2026-04-16 09:16:01.456792,2026-04-16 09:16:03.069549,0 days 00:00:01.612757,GELU,0.0036847914088542,4,206,74.0,53.0,56.0,,,,,,,PRUNED,2.798715422784302
313,1.038596749305725,2026-04-16 09:16:03.069907,2026-04-16 09:16:04.026322,0 days 00:00:00.956415,GELU,0.0013688585429195114,5,87,67.0,65.0,45.0,71.0,,,,,,PRUNED,1.019115670228716
314,4.674139499664307,2026-04-16 09:16:04.026669,2026-04-16 09:16:04.580401,0 days 00:00:00.553732,GELU,0.000483336065626286,2,170,80.0,,,,,,,,,PRUNED,2.1619758323497296
315,0.14698681235313416,2026-04-16 09:16:04.580765,2026-04-16 09:16:12.636838,0 days 00:00:08.056073,GELU,0.002310753951917947,4,210,87.0,27.0,86.0,,,,,,,COMPLETE,0.38338859184009916
316,0.9748244285583496,2026-04-16 09:16:12.637210,2026-04-16 09:16:21.783463,0 days 00:00:09.146253,GELU,0.001060262951342926,4,236,72.0,107.0,108.0,,,,,,,COMPLETE,0.987331974848556
317,84.5748519897461,2026-04-16 09:16:21.783846,2026-04-16 09:16:22.345380,0 days 00:00:00.561534,ReLU,0.0007341506430339702,4,221,63.0,76.0,20.0,,,,,,,PRUNED,9.196458665690075
318,1.3924517631530762,2026-04-16 09:16:22.345725,2026-04-16 09:16:22.942127,0 days 00:00:00.596402,GELU,0.0018591088866890294,2,215,81.0,,,,,,,,,PRUNED,1.1800219333355952
319,2.2252159118652344,2026-04-16 09:16:22.942456,2026-04-16 09:16:36.313644,0 days 00:00:13.371188,GELU,0.0009816225711200771,6,232,92.0,68.0,114.0,149.0,127.0,,,,,COMPLETE,1.4917157610836034
320,0.11928078532218933,2026-04-16 09:16:36.314028,2026-04-16 09:16:42.677856,0 days 00:00:06.363828,GELU,0.0027656219927601907,3,132,71.0,102.0,,,,,,,,COMPLETE,0.34537050441835554
321,0.28645405173301697,2026-04-16 09:16:42.678233,2026-04-16 09:16:49.499679,0 days 00:00:06.821446,GELU,0.003149774429981747,3,133,120.0,97.0,,,,,,,,COMPLETE,0.53521402423051
322,1.6093944311141968,2026-04-16 09:16:49.500041,2026-04-16 09:16:49.975936,0 days 00:00:00.475895,GELU,0.0026286969508425443,2,96,78.0,,,,,,,,,PRUNED,1.2686191040317014
323,2.365077257156372,2026-04-16 09:16:49.976261,2026-04-16 09:16:50.582054,0 days 00:00:00.605793,Tanh,0.0035316687407388313,3,151,65.0,102.0,,,,,,,,PRUNED,1.5378807681860034
324,1.276338815689087,2026-04-16 09:16:50.582397,2026-04-16 09:16:51.314656,0 days 00:00:00.732259,GELU,0.0055085177052400834,2,163,183.0,,,,,,,,,PRUNED,1.1297516610694083
325,0.23922139406204224,2026-04-16 09:16:51.314990,2026-04-16 09:16:59.724742,0 days 00:00:08.409752,GELU,0.001969281256523741,3,145,196.0,117.0,,,,,,,,COMPLETE,0.4891026416428787
326,8.164070129394531,2026-04-16 09:16:59.725113,2026-04-16 09:17:00.118760,0 days 00:00:00.393647,GELU,0.0013468468379304614,1,191,,,,,,,,,,PRUNED,2.8572836977441582
327,2.21639347076416,2026-04-16 09:17:00.119102,2026-04-16 09:17:01.645322,0 days 00:00:01.526220,GELU,0.008358221178132244,5,114,50.0,112.0,61.0,218.0,,,,,,PRUNED,1.488755678667309
328,0.6160851120948792,2026-04-16 09:17:01.645667,2026-04-16 09:17:06.936501,0 days 00:00:05.290834,GELU,0.002604632666512408,2,208,75.0,,,,,,,,,COMPLETE,0.7849108943662836
329,5.314725875854492,2026-04-16 09:17:06.936874,2026-04-16 09:17:09.253027,0 days 00:00:02.316153,Softplus,0.0017335075087621071,10,179,69.0,91.0,73.0,135.0,83.0,160.0,138.0,203.0,93.0,PRUNED,2.305368924023765
330,1.1444793939590454,2026-04-16 09:17:09.253395,2026-04-16 09:17:09.958966,0 days 00:00:00.705571,GELU,0.0013057639594894564,3,120,84.0,99.0,,,,,,,,PRUNED,1.0698034370663825
331,1.8071480989456177,2026-04-16 09:17:09.959316,2026-04-16 09:17:11.266858,0 days 00:00:01.307542,GELU,0.0040686856115768446,4,215,60.0,108.0,82.0,,,,,,,PRUNED,1.3443020861940287
332,0.24307766556739807,2026-04-16 09:17:11.267205,2026-04-16 09:17:22.789333,0 days 00:00:11.522128,GELU,0.002360049397710701,5,246,99.0,87.0,93.0,186.0,,,,,,COMPLETE,0.4930290717264024
333,0.39885181188583374,2026-04-16 09:17:22.789706,2026-04-16 09:17:32.154413,0 days 00:00:09.364707,GELU,0.0015981506753719758,4,159,160.0,120.0,78.0,,,,,,,COMPLETE,0.6315471572937635
334,1.1781953573226929,2026-04-16 09:17:32.154790,2026-04-16 09:17:32.749241,0 days 00:00:00.594451,GELU,0.0010523943424375333,2,220,89.0,,,,,,,,,PRUNED,1.0854470771634575
335,1.4826463460922241,2026-04-16 09:17:32.749573,2026-04-16 09:17:33.528644,0 days 00:00:00.779071,GELU,0.0019651267366577875,4,93,45.0,80.0,40.0,,,,,,,PRUNED,1.2176396618426257
336,8.978564262390137,2026-04-16 09:17:33.528989,2026-04-16 09:17:35.830053,0 days 00:00:02.301064,GELU,0.006247336823139495,8,203,76.0,95.0,192.0,105.0,146.0,211.0,182.0,,,PRUNED,2.996425247255492
337,5.225327968597412,2026-04-16 09:17:35.830402,2026-04-16 09:17:36.555436,0 days 00:00:00.725034,ELU,0.003406001843360437,3,228,57.0,105.0,,,,,,,,PRUNED,2.2858976286346273
338,0.3527875244617462,2026-04-16 09:17:36.555768,2026-04-16 09:17:45.209985,0 days 00:00:08.654217,GELU,0.00092207116306423,4,234,70.0,74.0,89.0,,,,,,,COMPLETE,0.593959194273265
339,0.8014037609100342,2026-04-16 09:17:45.210368,2026-04-16 09:17:47.580383,0 days 00:00:02.370015,GELU,0.0013351628316727435,6,242,83.0,61.0,133.0,90.0,59.0,,,,,PRUNED,0.8952115732663616
340,1.77734375,2026-04-16 09:17:47.580737,2026-04-16 09:17:48.384476,0 days 00:00:00.803739,GELU,0.000601350544316391,4,102,65.0,101.0,30.0,,,,,,,PRUNED,1.3331705629813464
341,92.92229461669922,2026-04-16 09:17:48.384816,2026-04-16 09:17:48.846600,0 days 00:00:00.461784,ReLU,0.0026691596684624893,3,224,36.0,89.0,,,,,,,,PRUNED,9.639621082630748
342,1.1905102729797363,2026-04-16 09:17:48.846941,2026-04-16 09:17:49.469469,0 days 00:00:00.622528,GELU,0.00151552461986937,2,256,79.0,,,,,,,,,PRUNED,1.0911050696334137
343,1.9259129762649536,2026-04-16 09:17:49.469810,2026-04-16 09:17:50.303966,0 days 00:00:00.834156,GELU,0.0007889921372874717,4,84,51.0,80.0,100.0,,,,,,,PRUNED,1.3877726673576454
344,0.5469743013381958,2026-04-16 09:17:50.304297,2026-04-16 09:18:01.215746,0 days 00:00:10.911449,GELU,0.0021063758247691113,5,213,87.0,71.0,68.0,174.0,,,,,,COMPLETE,0.7395771097986983
345,2.8722281455993652,2026-04-16 09:18:01.216120,2026-04-16 09:18:02.154998,0 days 00:00:00.938878,Tanh,0.0012136430769260425,4,218,169.0,92.0,97.0,,,,,,,PRUNED,1.6947649234036457
346,1.1648740768432617,2026-04-16 09:18:02.155354,2026-04-16 09:18:03.181651,0 days 00:00:01.026297,GELU,0.004614696589075856,2,232,73.0,,,,,,,,,PRUNED,1.0792933228938562
347,1.7450697422027588,2026-04-16 09:18:03.181997,2026-04-16 09:18:04.076951,0 days 00:00:00.894954,GELU,0.0005107138447068202,4,127,61.0,111.0,84.0,,,,,,,PRUNED,1.321010878911585
348,1.4677616357803345,2026-04-16 09:18:04.077285,2026-04-16 09:18:04.663856,0 days 00:00:00.586571,GELU,0.0009671790348516225,2,226,68.0,,,,,,,,,PRUNED,1.211512127789208
349,1.36085045337677,2026-04-16 09:18:04.664201,2026-04-16 09:18:11.952877,0 days 00:00:07.288676,GELU,0.0031255064218033927,4,109,27.0,128.0,52.0,,,,,,,COMPLETE,1.16655495086034
350,188.59890747070312,2026-04-16 09:18:11.953264,2026-04-16 09:18:13.170109,0 days 00:00:01.216845,GELU,7.291356408711567e-06,5,221,94.0,86.0,105.0,115.0,,,,,,PRUNED,13.733131743003964
351,6.746772766113281,2026-04-16 09:18:13.170457,2026-04-16 09:18:13.541057,0 days 00:00:00.370600,GELU,0.0017019849911290308,1,237,,,,,,,,,,PRUNED,2.597455055648371
352,2.8119235038757324,2026-04-16 09:18:13.541407,2026-04-16 09:18:14.440482,0 days 00:00:00.899075,GELU,0.0003330479477275482,4,212,55.0,57.0,90.0,,,,,,,PRUNED,1.676879096379859
353,0.8039569854736328,2026-04-16 09:18:14.440816,2026-04-16 09:18:17.139509,0 days 00:00:02.698693,GELU,0.000668013201313339,9,229,78.0,99.0,124.0,65.0,17.0,177.0,26.0,161.0,,PRUNED,0.8966364845764603
354,0.14331653714179993,2026-04-16 09:18:17.139850,2026-04-16 09:18:28.143622,0 days 00:00:11.003772,GELU,0.001133659647895781,4,216,228.0,75.0,78.0,,,,,,,COMPLETE,0.37857170673704593
355,5.937664031982422,2026-04-16 09:18:28.144004,2026-04-16 09:18:29.004026,0 days 00:00:00.860022,Softplus,0.001991713166042065,4,138,84.0,82.0,74.0,,,,,,,PRUNED,2.43673224462238
356,0.29979705810546875,2026-04-16 09:18:29.004380,2026-04-16 09:18:35.749569,0 days 00:00:06.745189,GELU,0.0014166682397319245,3,186,73.0,106.0,,,,,,,,COMPLETE,0.5475372664079302
