number,value,datetime_start,datetime_complete,duration,params_activation,params_lr,params_n_layers,params_n_units_l0,params_n_units_l1,params_n_units_l2,params_n_units_l3,params_n_units_l4,params_n_units_l5,params_n_units_l6,params_n_units_l7,params_n_units_l8,params_n_units_l9,state,RMSE
472,0.21753652393817902,2026-04-16 09:27:02.535079,2026-04-16 09:27:13.806457,0 days 00:00:11.271378,GELU,0.0023036309362280895,6,236,40.0,86.0,8.0,193.0,63.0,,,,,COMPLETE,0.4664081087826186
473,1.3962210416793823,2026-04-16 09:27:13.806842,2026-04-16 09:27:15.436999,0 days 00:00:01.630157,GELU,0.0018159076312635359,5,57,204.0,112.0,71.0,132.0,,,,,,PRUNED,1.1816179762001686
474,103.4472885131836,2026-04-16 09:27:15.437356,2026-04-16 09:27:16.762121,0 days 00:00:01.324765,ReLU,0.004883547667610082,10,231,71.0,127.0,83.0,119.0,19.0,198.0,31.0,114.0,170.0,PRUNED,10.170904016516113
475,1.5225157737731934,2026-04-16 09:27:16.762477,2026-04-16 09:27:17.319693,0 days 00:00:00.557216,GELU,0.0015189291449795878,2,202,55.0,,,,,,,,,PRUNED,1.2339026597642107
476,1.2516764402389526,2026-04-16 09:27:17.320021,2026-04-16 09:27:19.467170,0 days 00:00:02.147149,GELU,0.006924780774740888,9,244,78.0,58.0,103.0,160.0,37.0,127.0,81.0,255.0,,PRUNED,1.1187834644107646
477,0.10072708874940872,2026-04-16 09:27:19.467519,2026-04-16 09:27:33.435569,0 days 00:00:13.968050,GELU,0.00349125439250176,6,212,178.0,92.0,33.0,100.0,124.0,,,,,COMPLETE,0.3173753121296751
478,0.2524169087409973,2026-04-16 09:27:33.435959,2026-04-16 09:27:47.637509,0 days 00:00:14.201550,GELU,0.003122187611897762,6,210,180.0,94.0,38.0,111.0,127.0,,,,,COMPLETE,0.5024110953601615
479,28.430885314941406,2026-04-16 09:27:47.637881,2026-04-16 09:27:48.825375,0 days 00:00:01.187494,Tanh,0.004110957153164224,6,214,188.0,108.0,24.0,100.0,139.0,,,,,PRUNED,5.3320620134185805
480,1.312615156173706,2026-04-16 09:27:48.825738,2026-04-16 09:27:50.298652,0 days 00:00:01.472914,GELU,0.01257013306611103,6,207,166.0,66.0,39.0,66.0,119.0,,,,,PRUNED,1.1456941809111654
481,0.3728809952735901,2026-04-16 09:27:50.299006,2026-04-16 09:28:04.277688,0 days 00:00:13.978682,GELU,0.0037085492245407764,6,219,174.0,83.0,27.0,95.0,175.0,,,,,COMPLETE,0.6106398245067137
482,1.1551010608673096,2026-04-16 09:28:04.278074,2026-04-16 09:28:05.716322,0 days 00:00:01.438248,GELU,0.005763680759532386,6,212,158.0,101.0,30.0,59.0,114.0,,,,,PRUNED,1.0747562797524421
483,8.491506576538086,2026-04-16 09:28:05.716668,2026-04-16 09:28:07.435217,0 days 00:00:01.718549,GELU,0.0024894166482701792,7,227,169.0,117.0,44.0,84.0,14.0,230.0,,,,PRUNED,2.9140189732632296
484,2.628654956817627,2026-04-16 09:28:07.435568,2026-04-16 09:28:11.242075,0 days 00:00:03.806507,GELU,0.00881035437506949,6,35,239.0,173.0,109.0,115.0,147.0,,,,,PRUNED,1.6213127264095681
485,0.7082586288452148,2026-04-16 09:28:11.242417,2026-04-16 09:28:12.703692,0 days 00:00:01.461275,GELU,0.0026498248747763853,2,220,160.0,,,,,,,,,PRUNED,0.8415810292807311
486,1.8625452518463135,2026-04-16 09:28:12.704032,2026-04-16 09:28:14.645726,0 days 00:00:01.941694,GELU,0.00198598722266643,10,77,167.0,89.0,50.0,105.0,158.0,107.0,8.0,82.0,31.0,PRUNED,1.36475098528864
487,1.562769889831543,2026-04-16 09:28:14.646084,2026-04-16 09:28:16.089024,0 days 00:00:01.442940,GELU,0.0036853107979167884,3,204,154.0,61.0,,,,,,,,PRUNED,1.2501079512712263
488,4.33536958694458,2026-04-16 09:28:16.089366,2026-04-16 09:28:31.600829,0 days 00:00:15.511463,GELU,0.002072553434485142,6,215,174.0,156.0,118.0,90.0,125.0,,,,,COMPLETE,2.0821550343201105
489,4.873678684234619,2026-04-16 09:28:31.601212,2026-04-16 09:28:32.145891,0 days 00:00:00.544679,Softplus,0.0048803862613702115,2,226,46.0,,,,,,,,,PRUNED,2.2076409772049934
490,1.3647074699401855,2026-04-16 09:28:32.146242,2026-04-16 09:28:33.911363,0 days 00:00:01.765121,GELU,0.0028576109537410206,7,238,60.0,72.0,97.0,71.0,131.0,151.0,,,,PRUNED,1.1682069465382345
491,1.71609365940094,2026-04-16 09:28:33.911724,2026-04-16 09:28:34.658121,0 days 00:00:00.746397,GELU,0.0014719907657769831,4,98,28.0,98.0,19.0,,,,,,,PRUNED,1.3099975799217876
492,4.20120906829834,2026-04-16 09:28:34.658476,2026-04-16 09:28:36.575851,0 days 00:00:01.917375,GELU,0.000198192633645248,8,222,53.0,213.0,87.0,148.0,45.0,91.0,98.0,,,PRUNED,2.049685114425711
493,1.0555381774902344,2026-04-16 09:28:36.576212,2026-04-16 09:28:37.431684,0 days 00:00:00.855472,GELU,0.0017091180329920795,3,230,64.0,78.0,,,,,,,,PRUNED,1.0273938765099948
494,0.8770018815994263,2026-04-16 09:28:37.432029,2026-04-16 09:28:38.868774,0 days 00:00:01.436745,GELU,0.0035730719322596776,6,219,130.0,92.0,56.0,28.0,89.0,,,,,PRUNED,0.9364837860846424
495,5.112891674041748,2026-04-16 09:28:38.869124,2026-04-16 09:28:40.924736,0 days 00:00:02.055612,ELU,0.0064484694603427406,10,234,146.0,54.0,31.0,50.0,54.0,77.0,194.0,99.0,73.0,PRUNED,2.261170421273405
496,1.3195801973342896,2026-04-16 09:28:40.925087,2026-04-16 09:28:49.675178,0 days 00:00:08.750091,GELU,0.002481704648520546,4,213,35.0,84.0,91.0,,,,,,,COMPLETE,1.148729819119487
497,1.2693889141082764,2026-04-16 09:28:49.675555,2026-04-16 09:28:50.379568,0 days 00:00:00.704013,GELU,0.0014032390261492812,2,226,58.0,,,,,,,,,PRUNED,1.1266716088143325
498,1.2926548719406128,2026-04-16 09:28:50.379902,2026-04-16 09:28:51.276865,0 days 00:00:00.896963,GELU,0.0012207592323652426,4,84,68.0,164.0,33.0,,,,,,,PRUNED,1.1369498106515576
499,2.439443826675415,2026-04-16 09:28:51.277218,2026-04-16 09:28:53.505272,0 days 00:00:02.228054,GELU,0.001978873114329489,9,240,49.0,104.0,101.0,142.0,82.0,178.0,139.0,190.0,,PRUNED,1.5618718982923712
